,created_date,created_timestamp,subreddit,title,id,author,author_created_utc,full_link,score,num_comments,num_crossposts,subreddit_subscribers,post
377,2020-10-22 15:14:35,1603368875.0,kaggle,"HELLO WORD, I present you my first ever Kaggle notebook and submission",jfyh48,Professional_Time_75,,https://www.reddit.com/r/kaggle/comments/jfyh48/hello_word_i_present_you_my_first_ever_kaggle/,1.0,0.0,0.0,4514.0," I have recently joined a Kaggle competition on Knowledge Tracing.

I find this competition interesting and I've learned a lot comparing to where I've started.

So, here's my first baby on Kaggle (Sorry, I couldn't resist)

I created this notebook explaining my heuristic modeling approach.

It actually performed better than I expected (0.704 AUC).

Construtive criticsm is most than welcome, as my goal is to become better!

[Link to the new born](https://www.kaggle.com/sanabdriss/eda-on-questions-explanations-heuristic-model/)"
378,2020-10-22 15:59:38,1603371578.0,kaggle,My Second Kernel for Riiid Answer Correctness Prediction on Hyperparameter Tuning using Bayesian Optimization.,jfz58a,Athar_kaggle,,https://www.reddit.com/r/kaggle/comments/jfz58a/my_second_kernel_for_riiid_answer_correctness/,1.0,0.0,0.0,4514.0,"Bayesian Optimization  , Is one of the Fastest technique to Tune Hyperparameters of the Model , Recently I have Published a Kaggle Kernel , on ongoing RIIID :Answer Correctness Prediction Competition , which demonstrates How to Do Bayesian , Hyperparameter Tuning !
Link to the Kernel :
https://www.kaggle.com/sayedathar11/riiid-lgbm-hyperopt-paramstuning

#datascience #datascience #deeplearning #python #kaggle
#ai"
379,2020-10-25 21:19:20,1603653560.0,kaggle,Does anyone have an output file of 2019 GlassDoor ratings?,jhz8m4,ProfCollins,,https://www.reddit.com/r/kaggle/comments/jhz8m4/does_anyone_have_an_output_file_of_2019_glassdoor/,1.0,0.0,0.0,4525.0,"Hello, doing some research and was curious is any in the community had a file that contains GD ratings from 2019 - looking to compare to today's ratings - thanks in advance!"
380,2020-10-27 21:43:40,1603827820.0,kaggle,looking for a kaggle team:),jj8am6,lostwithtech,,https://www.reddit.com/r/kaggle/comments/jj8am6/looking_for_a_kaggle_team/,1.0,1.0,0.0,4535.0,"hey guys, I am looking for somebody (or a couple of people) to form a consistent kaggle team with to push for a gold medal and hit masters eventually. If any of you are interested in teaming up with me, let me know. I lost 2 medals already because of new teammates that didn't know/follow the rules, so please have at least 1 solo medal. Cheers"
381,2020-10-28 01:32:59,1603841579.0,kaggle,Are Kaggle Deep Learning Competitions always done with TensorFlow?,jjcoo2,BeastCoder,,https://www.reddit.com/r/kaggle/comments/jjcoo2/are_kaggle_deep_learning_competitions_always_done/,1.0,5.0,0.0,4535.0,"I'm interested in deep learning, but I'm really focused on learning it from scratch without any helping packages like TensorFlow. I was wondering if the Kaggle competitions are usually all done with TensorFlow? I ask because I noticed the ""Courses"" section taught TensorFlow in its deep learning section. Thanks!"
382,2020-10-31 23:08:00,1604178480.0,kaggle,"Do you know any cancer dataset, which can be used for computer vision algorithms?",jlq65d,datonefaridze,,https://www.reddit.com/r/kaggle/comments/jlq65d/do_you_know_any_cancer_dataset_which_can_be_used/,1.0,0.0,0.0,4547.0,"Hello, I am interested if there is any Kaggle competition about a disease where machine learning algorithms do terrible jobs. I want to work on those problems. I don't want to work on breast cancer detection because people can detect it by 96% accuracy and that is very high, I am looking for cancer or disease datasets where machine learning algorithms don't perform well."
383,2020-11-01 20:54:27,1604256867.0,kaggle,which disease dataset can you suggest for machine learning algorithms,jm7o5m,datonefaridze,,https://www.reddit.com/r/kaggle/comments/jm7o5m/which_disease_dataset_can_you_suggest_for_machine/,1.0,1.0,0.0,4551.0,"Hello, I want to work on disease datasets like COVID, NORMAL, Pneumonia, dataset. I am looking for a skin cancer dataset or breast cancer dataset on Kaggle. Do you know such a dataset? on Kaggle or outside of it?"
384,2020-11-02 15:17:34,1604323054.0,kaggle,How Kaggle Makes GPUs Accessible to 5 Million Data Scientists,jmn80r,samketa,,https://www.reddit.com/r/kaggle/comments/jmn80r/how_kaggle_makes_gpus_accessible_to_5_million/,1.0,0.0,0.0,4553.0,
385,2020-11-09 08:11:02,1604902262.0,kaggle,How to use Alteryx to compete in Kaggle Comps,jqscjd,tvnk,,https://www.reddit.com/r/kaggle/comments/jqscjd/how_to_use_alteryx_to_compete_in_kaggle_comps/,1.0,0.0,0.0,4589.0,
386,2020-11-11 05:23:49,1605065029.0,kaggle,I am not able to install packages in kaggle,js0c1f,PositiveMaybe7,,https://www.reddit.com/r/kaggle/comments/js0c1f/i_am_not_able_to_install_packages_in_kaggle/,1.0,0.0,0.0,4597.0,"Im getting this error-

 WARNING: Retrying (Retry(total=1, connect=None, read=None, redirect=None, status=None)) after connection broken by 'NewConnectionError('&lt;pip.\_vendor.urllib3.connection.HTTPSConnection object at 0x7f6d0ecd9ad0&gt;: Failed to establish a new connection: \[Errno -3\] Temporary failure in name resolution')': /simple/yfinance/"
387,2020-11-11 10:50:50,1605084650.0,kaggle,Image cover crashing after updating dataset by API,js4poe,Unanimad,,https://www.reddit.com/r/kaggle/comments/js4poe/image_cover_crashing_after_updating_dataset_by_api/,1.0,0.0,0.0,4598.0,Hello guys! I'm trying figure out why the dataset's cover crash after using API to update it. Does anyone else had the same problem?
388,2020-11-13 17:26:46,1605281206.0,kaggle,Commit to save output,jthkdj,cristiankusch,,https://www.reddit.com/r/kaggle/comments/jthkdj/commit_to_save_output/,1.0,3.0,0.0,4609.0,"Hello,

I was training a model with yolo on kaggle but after a while it disconnected apparently it was inactive and the output model was lost, but i hadn't pressed the commit button.

Now i've started again and  i've comitted it right away and i'm saving the model in /kaggle/working/output

If it disconnects again will the model be lost again? 

thanks"
389,2020-11-14 18:27:22,1605371242.0,kaggle,[Beginner] Notebook on Detection of Masks and Social Distancing Violations in an Image,ju4ku7,giwilorjelly,,https://www.reddit.com/r/kaggle/comments/ju4ku7/beginner_notebook_on_detection_of_masks_and/,1.0,0.0,0.0,4611.0,
390,2020-11-16 18:29:52,1605544192.0,kaggle,Kaggle is down?,jv9rhj,[deleted],,https://www.reddit.com/r/kaggle/comments/jv9rhj/kaggle_is_down/,1.0,0.0,0.0,4619.0,
391,2020-11-19 15:59:35,1605794375.0,kaggle,-Exploratory Data Analysis -Statistical Analysis - Four ML and DL models for Hotel booking cancellation prediction,jx35iq,JeffOnPurpose,,https://www.reddit.com/r/kaggle/comments/jx35iq/exploratory_data_analysis_statistical_analysis/,1.0,0.0,0.0,4625.0,
392,2020-11-20 18:22:42,1605889362.0,kaggle,Exploring the Lyft Prediction Dataset with VizViewer,jxs2ra,[deleted],,https://www.reddit.com/r/kaggle/comments/jxs2ra/exploring_the_lyft_prediction_dataset_with/,1.0,0.0,0.0,4630.0,
393,2020-11-20 18:25:20,1605889520.0,kaggle,An exploration into the Lyft Prediction Autonomous Vehicles dataset with VizViewer,jxs4kf,j-rojas,,https://www.reddit.com/r/kaggle/comments/jxs4kf/an_exploration_into_the_lyft_prediction/,1.0,1.0,0.0,4630.0,
394,2020-11-20 22:09:06,1605902946.0,kaggle,Amazing Dataset of Temperature Humidity readings for IOT devices. (Time series) -&gt; Upvote !,jxwg46,Atul-Anand-Jha,,https://www.reddit.com/r/kaggle/comments/jxwg46/amazing_dataset_of_temperature_humidity_readings/,1.0,0.0,0.0,4630.0,
395,2020-11-22 14:39:08,1606048748.0,kaggle,"Do you believe in the quote ""Competition is for Losers ""?",jyv0sk,Psycho-logical-being,,https://www.reddit.com/r/kaggle/comments/jyv0sk/do_you_believe_in_the_quote_competition_is_for/,1.0,4.0,0.0,4641.0,
396,2020-11-23 14:19:48,1606133988.0,kaggle,Kaggle API does not download the entire dataset,jzglrh,janissary2016,,https://www.reddit.com/r/kaggle/comments/jzglrh/kaggle_api_does_not_download_the_entire_dataset/,1.0,0.0,0.0,4647.0," Hi.

I am trying to download the statefarm distracted driver detection dataset using the API key on Colab:

`!kaggle competitions download -c state-farm-distracted-driver-detection`

However, all this does is just download a handful of images. The dataset is 4.0GB large."
397,2020-11-28 12:48:45,1606560525.0,kaggle,Looking for a teammate,k2lphg,d_r_y,,https://www.reddit.com/r/kaggle/comments/k2lphg/looking_for_a_teammate/,1.0,6.0,0.0,4672.0,"I'm a beginner for machine learning. I'm looking for a team to participate in kaggle competitions.
I'm participating in MoA competition. That's it I don't have much experience. If you have interest, we can learn together. :)"
398,2020-11-30 19:05:55,1606755955.0,kaggle,Looking for team - Jane Street Market Prediction,k3zxgd,d0min4te,,https://www.reddit.com/r/kaggle/comments/k3zxgd/looking_for_team_jane_street_market_prediction/,1.0,2.0,0.0,4677.0,"Hi,

I'm new to Kaggle and looking to join a competitive team w/ (ideally non-finance) ML experts. I'm well-versed in time series ML applied to trading but interested in learning from and collaborating with a team that has a more rigorous ML and Kaggle background.

I have an MS in applied math from Columbia. I previously worked in alternative data (NLP/sentiment analysis) for trading and now currently work as a commodities/global macro mid-frequency quant (often implementing ML based models).

[https://www.linkedin.com/in/coltonfsmith/](https://www.linkedin.com/in/coltonfsmith/)  
[https://quantoisseur.com/](https://quantoisseur.com/)

PM if interested please."
399,2020-12-01 13:19:56,1606821596.0,kaggle,Looking for a kaggle team,k4j1kb,_KhanShaheb,,https://www.reddit.com/r/kaggle/comments/k4j1kb/looking_for_a_kaggle_team/,1.0,12.0,0.0,4681.0,"Hi, I'm new at Kaggle and competitive data science. I want to join or create a team with some other newbie like me then learn and compete together. 

Is anyone interested?"
400,2020-12-01 20:15:36,1606846536.0,kaggle,Find the perfect teammate for your Kaggle competitions,k4qif4,_KhanShaheb,,https://www.reddit.com/r/kaggle/comments/k4qif4/find_the_perfect_teammate_for_your_kaggle/,1.0,0.0,0.0,4684.0,"A few hours ago I shared a post asking for Kaggle teammates. And got a lot of interested people. But Kaggle won't allow me to add all of them to my team. Someone did give advice in the comment, that a Discord server might help others to find their teammates too.

So I created a Discord server to find your suitable Kaggle Teammate. Click the link to join: [https://discord.gg/srHwUsyPM6](https://discord.gg/srHwUsyPM6)

Btw, I'm not very good at managing a discord server. So I need some help to manage the server too. If you are interested to help, please let me know."
401,2020-12-06 18:09:14,1607270954.0,kaggle,"Google researcher Da Huang participated in Kaggle M5 forecasting competition backed by and on behalf of Kaggle team, but this was never disclosed to other M5 forecasting competition participants.",k7we5c,predict_machine,,https://www.reddit.com/r/kaggle/comments/k7we5c/google_researcher_da_huang_participated_in_kaggle/,1.0,2.0,0.0,4697.0,"It appears Google researcher Da Huang was participating in Kaggle M5 forecasting competition on behalf of the team, but this was never disclosed to other M5 forecasting competition participants, neither other Kaggle team members were registered as part of “Huang” team. Kaggle rules about teams are strict and straightforward and this was clearly team efforts based on Google announcement today.

What does Kaggle community think about it? Did Da Huang broke Kaggle rules, Kaggle is of course owned by Google. 


https://ai.googleblog.com/2020/12/using-automl-for-time-series-forecasting.html?m=1"
402,2020-12-09 23:37:07,1607549827.0,kaggle,Kaggle Rules - Pretrained Models,ka19yy,AncientArsehole,,https://www.reddit.com/r/kaggle/comments/ka19yy/kaggle_rules_pretrained_models/,1.0,5.0,0.0,4708.0,"I'm thinking of entering a kaggle competition, my first one, and reading the rules I'm a little confused:

https://www.kaggle.com/c/jane-street-market-prediction/overview/code-requirements

&gt;Your notebook must use the time-series module to make predictions
CPU Notebook &lt;= 5 hours run-time
GPU Notebook &lt;= 5 hours run-time
TPU Notebooks are not supported
Freely &amp; publicly available external data is allowed, including pre-trained models


Does that mean I can pre-train my own model, release it on github, say the day before, then make a submission using this pre-trained model?

That seems to align with the rules. but given the runtime is 5h, and I can pretrain a model with 5000h worth of equivalent training time, then use that it doesn't seem very fair?"
403,2020-12-10 11:55:18,1607594118.0,kaggle,"AutoML, pandas profiling, random forest modelling with Titanic_dataset",kacp5s,shyamcody,,https://www.reddit.com/r/kaggle/comments/kacp5s/automl_pandas_profiling_random_forest_modelling/,1.0,1.0,0.0,4711.0,
404,2020-12-10 15:01:16,1607605276.0,kaggle,"Housing data[ exploratory data analysis, one-hot-encoding, grid-search and random forest hyper-parameter tuning]",kaevkt,shyamcody,,https://www.reddit.com/r/kaggle/comments/kaevkt/housing_data_exploratory_data_analysis/,1.0,1.0,0.0,4711.0,
405,2020-12-10 19:14:22,1607620462.0,kaggle,television-advertisement-detection starter notebook,kajd4z,shyamcody,,https://www.reddit.com/r/kaggle/comments/kajd4z/televisionadvertisementdetection_starter_notebook/,1.0,0.0,0.0,4711.0,
406,2020-12-10 21:05:22,1607627122.0,kaggle,Dog/Cat Classification [explored different activation functions and combinations of cnn layers],kalo9m,shyamcody,,https://www.reddit.com/r/kaggle/comments/kalo9m/dogcat_classification_explored_different/,1.0,0.0,0.0,4712.0,
407,2020-12-10 22:15:05,1607631305.0,kaggle,detect-breast-cancer(96% w logistic regression),kan52b,shyamcody,,https://www.reddit.com/r/kaggle/comments/kan52b/detectbreastcancer96_w_logistic_regression/,1.0,1.0,0.0,4712.0,
408,2020-12-12 00:21:35,1607725295.0,kaggle,television-advertisement-detection,kbcqn1,shyamcody,,https://www.reddit.com/r/kaggle/comments/kbcqn1/televisionadvertisementdetection/,1.0,0.0,0.0,4717.0,
409,2020-12-12 11:42:53,1607766173.0,kaggle,xgboost parameters: {early_stopping_rounds} might not be used. | Data Science and Machine Learning,kbmhpo,shyamcody,,https://www.reddit.com/r/kaggle/comments/kbmhpo/xgboost_parameters_early_stopping_rounds_might/,1.0,0.0,0.0,4721.0,
410,2020-12-13 08:29:42,1607840982.0,kaggle,"Exploring SVM and achieving 88% F1-score with BBC tv commercial data[NuSVC,SVC,LinearSVC, rbf, sigmoid and polynomial kernel explored]",kc5toe,shyamcody,,https://www.reddit.com/r/kaggle/comments/kc5toe/exploring_svm_and_achieving_88_f1score_with_bbc/,1.0,1.0,0.0,4726.0,
411,2020-12-13 21:26:23,1607887583.0,kaggle,Ok Idk whats going on but I've done this exercise about 20 times now and it still won't get checked off. It's really pissing me off. Does anyone know why this is happening?,kcguxh,Nespeky,,https://www.reddit.com/r/kaggle/comments/kcguxh/ok_idk_whats_going_on_but_ive_done_this_exercise/,1.0,2.0,0.0,4729.0,
412,2020-12-15 13:17:21,1608031041.0,kaggle,From zero to Kaggle competitor for existing Python web developer,kdjxxg,jonwhittlestone,,https://www.reddit.com/r/kaggle/comments/kdjxxg/from_zero_to_kaggle_competitor_for_existing/,1.0,8.0,0.0,4742.0,"Hi

I am a jobbing Python developer and wonder if any one has any advice/guidelines to spend future months/years self learning to get up to decent skill level to be able to compete in Kaggle competitions?

Are there any types of Kaggle competitions on which  a beginner should focus?

Thanks"
413,2020-12-16 11:30:09,1608111009.0,kaggle,Singing the correct Birds-song with lazypredict [explored automl library Lazypredict and reached 98% accuracy][upvote the notebook for increased visibility],ke659z,shyamcody,,https://www.reddit.com/r/kaggle/comments/ke659z/singing_the_correct_birdssong_with_lazypredict/,1.0,0.0,0.0,4745.0,
414,2020-12-17 22:47:49,1608238069.0,kaggle,Optimum usage of Kaggle,kf5wjt,promptcloud,,https://www.reddit.com/r/kaggle/comments/kf5wjt/optimum_usage_of_kaggle/,0.0,7.0,0.0,4750.0,Hey there I have a page on Kaggle and do regularly post Datasets on there. What has to be done to get more engagement in those datasets?
415,2020-12-19 20:05:04,1608401104.0,kaggle,Nominal Output Label,kgcrl8,rayhanbracu,,https://www.reddit.com/r/kaggle/comments/kgcrl8/nominal_output_label/,1.0,0.0,0.0,4759.0,"I have trained a model with LabelEncoder from sklearn which transformed the output column into integers, therefore, considering output classes as ordinal data. However, I am interested in training the model with one-hot encoded labels. But when I apply one hot encoding, my output column breaks down into as many number of columns as the output class. My question is , **Do I have to declare my Y label as multiple columns ? How is the one hot encoding process giving me a Vector? Isn't it just several independent columns?**  
Can someone provide an code snippet example of an SVM implementation with OHE label."
416,2020-12-20 10:09:42,1608451782.0,kaggle,Thin content web page data | Data Science and Machine Learning,kgqeba,shyamcody,,https://www.reddit.com/r/kaggle/comments/kgqeba/thin_content_web_page_data_data_science_and/,1.0,0.0,0.0,4760.0,
417,2020-12-20 15:43:48,1608471828.0,kaggle,"Thin content webpage data [ a notebook exploring thin content webpages, with clustering and dimensionality reduction using keras]",kgu7dm,shyamcody,,https://www.reddit.com/r/kaggle/comments/kgu7dm/thin_content_webpage_data_a_notebook_exploring/,1.0,1.0,0.0,4759.0,
418,2020-12-20 20:51:26,1608490286.0,kaggle,How to use VGG16 in Kaggle inference ?,kgzp19,maifee,,https://www.reddit.com/r/kaggle/comments/kgzp19/how_to_use_vgg16_in_kaggle_inference/,1.0,0.0,0.0,4759.0,
419,2020-12-20 23:45:04,1608500704.0,kaggle,Find your teammate for your Kaggle competitions,kh32mv,pygold,,https://www.reddit.com/r/kaggle/comments/kh32mv/find_your_teammate_for_your_kaggle_competitions/,1.0,1.0,0.0,4762.0,"The jane street market prediction is halfaway through and I have been working on this competition lately and really learnt a lot from it, I was looking for Kaggle teammates. And got a lot of interested people. But I am unable to add all of them to my team. Someone did give me advice that a Discord server might help others to find their teammates.

that's why I created a dedicated room specifically for this competition in my Discord server for you guys to find your suitable Kaggle Teammate. Click the link to join: [https://discord.gg/6uwvUzBH6Q](https://discord.gg/6uwvUzBH6Q)

Happy kaggeling"
420,2020-12-22 22:37:20,1608669440.0,kaggle,Into the communities of Kaggle[data visualization notebook],kidj6r,shyamcody,,https://www.reddit.com/r/kaggle/comments/kidj6r/into_the_communities_of_kaggledata_visualization/,1.0,0.0,0.0,4771.0,
421,2020-12-23 23:46:01,1608759961.0,kaggle,80% with vector embedding+feature engineering in disaster tweet prediction,kj21vl,shyamcody,,https://www.reddit.com/r/kaggle/comments/kj21vl/80_with_vector_embeddingfeature_engineering_in/,1.0,1.0,0.0,4772.0,
422,2020-12-24 22:07:39,1608840459.0,kaggle,Titanic : A complete guide for beginners (Kaggle Project),kjlvl3,shivadumnawar14,,https://www.reddit.com/r/kaggle/comments/kjlvl3/titanic_a_complete_guide_for_beginners_kaggle/,1.0,0.0,0.0,4773.0," 

Hi guys,  
[https://www.kaggle.com/shivadumnawar/titanic-a-complete-tutorial-for-beginners](https://www.kaggle.com/shivadumnawar/titanic-a-complete-tutorial-for-beginners)  
check out this link, it is a complete tutorial for beginners.

The following steps are involved in this kernel.

**Steps**

* what is classification?
* what is Logistic Regression?
* imports
* Handling missing values
* Data visualization
* removing outliers
* One Hot Encoding
* Feature Scaling
* Submission

Hope, it is useful. Happy Learning :)"
423,2020-12-25 12:33:07,1608892387.0,kaggle,NLP techniques with disaster tweet prediction,kjx14d,shyamcody,,https://www.reddit.com/r/kaggle/comments/kjx14d/nlp_techniques_with_disaster_tweet_prediction/,1.0,0.0,0.0,4774.0,"So recently I created this notebook in kaggle for the knowledge competition ""NLP with disaster tweet"". I have gone through explicit ways to generate features, how to create tf-idf features, how to generate vector embedding from spacy, and extensive text cleaning methods. I have tried to create it so that any NLP beginner can get helped with it. Would love to see people reading and feel great if some can be helped by it.

The notebook link: [here](https://www.kaggle.com/shyambhu/80-with-vector-embedding-feature-engineering)

Please upvote in kaggle if you like the content of the notebook!"
424,2020-12-25 18:13:24,1608912804.0,kaggle,kaggle review,kk1f32,fthdmirr,,https://www.reddit.com/r/kaggle/comments/kk1f32/kaggle_review/,1.0,0.0,0.0,4775.0,"   
I'm new to kaggle. Can you review my notebook?   
If there are things I do wrong and things you can advise on, you would make me very happy. 

[https://www.kaggle.com/fthdmirr/suicide-rates-and-possible-causes](https://www.kaggle.com/fthdmirr/suicide-rates-and-possible-causes)"
425,2020-12-27 15:34:39,1609076079.0,kaggle,Kaggle Console,kl3rhc,RstarPhoneix,,https://www.reddit.com/r/kaggle/comments/kl3rhc/kaggle_console/,1.0,0.0,0.0,4787.0,How to get the location of the notebook that you are working on via kaggle console ?
426,2020-12-29 02:26:03,1609201563.0,kaggle,Acea Smart Water Analytics team,km2tgb,jvera701,,https://www.reddit.com/r/kaggle/comments/km2tgb/acea_smart_water_analytics_team/,1.0,0.0,0.0,4797.0,"Hi everyone, I am looking for a team to work on Acea Smart Water Analytics. About myself, I recently graduated in CS and I did my thesis on appied ML .. You can find the link to the competition here.

[https://www.kaggle.com/c/acea-water-prediction/](https://www.kaggle.com/c/acea-water-prediction/)

I would prefer to work with people close to my timezone (GMT-5). If interested, you can DM me. Thanks !"
427,2020-12-31 20:56:43,1609441003.0,kaggle,NotFoundError: Container worker does not exist when running CNN with TPU accelerator,knvrpl,jokePerallta,,https://www.reddit.com/r/kaggle/comments/knvrpl/notfounderror_container_worker_does_not_exist/,1.0,0.0,0.0,4808.0,"Hi,

I am trying to run some CNN models with TPU and I am getting the above error. This is after the first epoch ends and while validation happens.

I have used TPU previously (yesterday) and did not have this issue. After a bit of googling, I see that this issue was observed earlier due to Keras and Tensorflow version mismatch when fit\_generator was used. But those posts were like over a year or two ago and my versions are different from what was posted then. (This is the [similar issue](https://www.kaggle.com/product-feedback/66339), [link 2](https://github.com/keras-team/keras/issues/10948))

***This is the error***

    NotFoundError: Container worker does not exist. (Could not find resource: worker/_AnonymousVar5104)
    	Encountered when executing an operation using EagerExecutor. This error cancels all future operations and poisons their output tensors.

I have tried to run a custom CNN model I have created and also tried using transfer learning with Resnet50.

This is with Resnet50 as described in a [tutorial here](https://www.kaggle.com/jessemostipak/getting-started-tpus-cassava-leaf-disease/notebook#Train-the-model)

    with strategy.scope():       
        img_adjust_layer = tf.keras.layers.Lambda(tf.keras.applications.resnet50.preprocess_input, input_shape=[*IMAGE_SIZE, 3])
        
        base_model = tf.keras.applications.ResNet50(weights='imagenet', include_top=False)
        base_model.trainable = False
        
        model = tf.keras.Sequential([
            tf.keras.layers.BatchNormalization(renorm=True),
            img_adjust_layer,
            base_model,
            tf.keras.layers.GlobalAveragePooling2D(),
            tf.keras.layers.Dense(8, activation='relu'),
            #tf.keras.layers.BatchNormalization(renorm=True),
            tf.keras.layers.Dense((NO_OF_CATEGORIES), activation='softmax')  
        ])
        
        model.compile(
            optimizer=tf.keras.optimizers.Adam(learning_rate=lr_scheduler, epsilon=0.001),
            loss='sparse_categorical_crossentropy',  
            metrics=['sparse_categorical_accuracy'])
    
    # load data
    train_dataset = get_training_dataset()
    valid_dataset = get_validation_dataset()
    
    STEPS_PER_EPOCH = NUM_TRAINING_IMAGES // BATCH_SIZE
    VALID_STEPS = NUM_VALIDATION_IMAGES // BATCH_SIZE
    
    history = model.fit(train_dataset, 
                        steps_per_epoch=STEPS_PER_EPOCH, 
                        epochs=EPOCHS,
                        validation_data=valid_dataset,
                        validation_steps=VALID_STEPS,
                        callbacks=[checkpoint,
                                   csv_logger,
                                   earlystopper,
                                   reduceLROnPlateau,
                                   tensorboard],
    )

I have around 14.7k images in the training dataset and 6.7k in validation. Images are RGB and  originally  \[800,600\] but my input shape is \[512,512\]

&amp;#x200B;

Thanks in advance."
428,2021-01-02 02:10:22,1609546222.0,kaggle,The Most Underrated Machine Learning Algorithm (WINS KAGGLE COMPETITIONS),komh6b,khanradcoder,,https://www.reddit.com/r/kaggle/comments/komh6b/the_most_underrated_machine_learning_algorithm/,1.0,1.0,0.0,4818.0,
429,2021-01-03 14:04:37,1609675477.0,kaggle,The mysterious case of red wine regression,kpjjao,shyamcody,,https://www.reddit.com/r/kaggle/comments/kpjjao/the_mysterious_case_of_red_wine_regression/,1.0,0.0,0.0,4823.0,
