,created_date,created_timestamp,subreddit,title,id,author,author_created_utc,full_link,score,num_comments,num_crossposts,subreddit_subscribers,post
0,2016-02-18 20:36:27,1455820587.0,kaggle,Simple SVM for the Kaggle Knowledge Competition Digit Recognizer,46g7ns,TonyRomaRock,1412493263.0,https://www.reddit.com/r/kaggle/comments/46g7ns/simple_svm_for_the_kaggle_knowledge_competition/,0.0,0.0,,,
1,2016-06-30 19:51:16,1467305476.0,kaggle,How To: A Shiny New Python Data Science Sandbox in 30 Minutes Or Less (x-post from r/datascience),4qmp6n,UVAnalytics,1415746367.0,https://www.reddit.com/r/kaggle/comments/4qmp6n/how_to_a_shiny_new_python_data_science_sandbox_in/,1.0,1.0,,,
2,2016-08-17 15:30:57,1471437057.0,kaggle,A guided step-by-step python tutorial to solve the Titanic challenge on Kaggle and score 0.8134 (top 10%),4y5ahk,ahmedbesbes,1471436227.0,https://www.reddit.com/r/kaggle/comments/4y5ahk/a_guided_stepbystep_python_tutorial_to_solve_the/,2.0,0.0,,,
3,2016-08-27 16:17:22,1472303842.0,kaggle,US Stocks Fundamentals Dataset on Kaggle,4zu6gh,usfundamentals,1467468985.0,https://www.reddit.com/r/kaggle/comments/4zu6gh/us_stocks_fundamentals_dataset_on_kaggle/,2.0,0.0,,,
4,2016-10-04 06:33:20,1475552000.0,kaggle,this dataset 522 downloads at Kaggle. and Now new data 2016 Aug is available,55rndc,zanjibar,1474155504.0,https://www.reddit.com/r/kaggle/comments/55rndc/this_dataset_522_downloads_at_kaggle_and_now_new/,1.0,0.0,,,
5,2016-11-13 02:17:56,1478996276.0,kaggle,Let's make an official Discord community for AI research,5cncr4,SyntaxExpert,1415995121.0,https://www.reddit.com/r/kaggle/comments/5cncr4/lets_make_an_official_discord_community_for_ai/,1.0,0.0,,,
6,2017-04-11 23:23:42,1491942222.0,kaggle,looking to team up to make kaggle team,64tgj2,[deleted],,https://www.reddit.com/r/kaggle/comments/64tgj2/looking_to_team_up_to_make_kaggle_team/,1.0,0.0,,,
7,2017-08-03 18:29:16,1501774156.0,kaggle,"DataPanda - Focus on accuracy, not data cleaning",6rd1p7,theoszymk,,https://www.reddit.com/r/kaggle/comments/6rd1p7/datapanda_focus_on_accuracy_not_data_cleaning/,1.0,0.0,,,
8,2017-11-16 18:40:49,1510850449.0,kaggle,Can I only report the result of a study in Kaggle?,7ddl90,amoun1365,,https://www.reddit.com/r/kaggle/comments/7ddl90/can_i_only_report_the_result_of_a_study_in_kaggle/,1.0,0.0,0.0,,"Hi,

I have done a study on detecting disturbances in utilities using machine learning algorithms. Since most of the codes are confidential to the the funder of the project, it would not be possible to share them.
However, I can share my math, algorithm flowchart, result, and the research philosophy. I wonder if this is something possible on Kaggle.
Disturbance detection in power system is a really nice field.
Here is a link to the study we did:
http://ieeexplore.ieee.org/document/6915897/"
9,2017-11-30 07:01:27,1512018087.0,kaggle,"What are some comprehensive kernels on ""Kaggle"" so that one can learn data science by practicing those kernels?",7gjvwb,amoun1365,,https://www.reddit.com/r/kaggle/comments/7gjvwb/what_are_some_comprehensive_kernels_on_kaggle_so/,4.0,1.0,0.0,,
10,2017-12-06 18:25:20,1512577520.0,kaggle,When you can share a forked kernel as yours?,7hz3su,amoun1365,,https://www.reddit.com/r/kaggle/comments/7hz3su/when_you_can_share_a_forked_kernel_as_yours/,2.0,0.0,0.0,,"I have forked a good titanic kernel and started doing changes in it where required. I was wondering, how much of it shall I change to be able to share it as my own project?"
11,2017-12-12 06:20:05,1513052405.0,kaggle,"Learning R's dplyr, ggplot, and EDA with Pokemon",7j8799,jubeilicious,,https://www.reddit.com/r/kaggle/comments/7j8799/learning_rs_dplyr_ggplot_and_eda_with_pokemon/,3.0,0.0,0.0,,
12,2017-12-28 12:02:50,1514455370.0,kaggle,Kaggle Kernel Only Submission?,7mlrk9,hi_im_ryanli,,https://www.reddit.com/r/kaggle/comments/7mlrk9/kaggle_kernel_only_submission/,1.0,0.0,0.0,,"Hi,

I am a new Kaggle user and I am wondering if there is any way of allowing the code to run for longer times in a kernel only submission?

My model (a stacked LSTM) takes a while to train, and it seems that for the competition, I can only submit a kernel and letting it run for 60 minutes (then it times out). 

The model is no way near full convergence and it is really frustrating fight against the timer, modifying the code so that it can preprocess the data, train the model, and finish the prediction in time.

I am wondering if there is any way around this? Or this is just the nature of a ""kernel-only"" competition?"
13,2018-01-06 08:38:24,1515220704.0,kaggle,Does anyone have a solution for loading Julia packages on Kaggle?,7oho93,aureum_borealis,,https://www.reddit.com/r/kaggle/comments/7oho93/does_anyone_have_a_solution_for_loading_julia/,2.0,0.0,0.0,,"Howdy,
       I am having issues loading Julia packages on Kaggle when I script in Julia.  The issue I am running into is that there is a load error.  The use case is: Pkg.add(""DataFrames"") (new line) using DataFrames (end).  This code compiles properly on my laptop but does not work on Kaggle.  Does anyone have a better idea of how to program in Julia on Kaggle and how to alter my code so I can use it?  Thank you."
14,2018-01-10 23:31:40,1515619900.0,kaggle,What is the most effective way to achieve Kaggle Expert ranking?,7pixd7,Xshayarshan,,https://www.reddit.com/r/kaggle/comments/7pixd7/what_is_the_most_effective_way_to_achieve_kaggle/,1.0,1.0,0.0,,"I am new to Kaggle, and I wanted to see how can I effectively become a Kaggle Expert? which competitions are more straightforward for achieving a bronze medal? I know it really depends on the level of my expertise, but I thought maybe some datasets are less challenging than the rest?
Thank you."
15,2018-01-22 17:07:51,1516633671.0,kaggle,Ever worked in a crowd team through platforms like kaggle or innocentive? I'd appreciate your help big time,7s6bpy,mehrtueler,,https://www.reddit.com/r/kaggle/comments/7s6bpy/ever_worked_in_a_crowd_team_through_platforms/,1.0,1.0,0.0,,"Hey, for a master's thesis I'm currently researching crowd teams, that find together via intermediaries likle Kaggle, Innocentive or upwork and work on e.g. innovation projects (or else). If you've ever done something like that, check out the pre registration for a short survey below. Your participation would be of great help, thanks a lot in advance!!

https://www.surveymonkey.com/r/LTRDLRJ"
16,2018-02-03 20:19:43,1517681983.0,kaggle,How to setup the dataset as X and Y for the Dog Breed classification dataset?,7v10h9,thisisppn,,https://www.reddit.com/r/kaggle/comments/7v10h9/how_to_setup_the_dataset_as_x_and_y_for_the_dog/,1.0,1.0,0.0,,"I am aware of the keras way of structuring the folders where you create classes as folders and put the respective labeled images in them. 

But in the case of the Dog Breed Classification dataset, the images are all in one folder and the labelling is done in a separate CSV file. 

I am new to this. Can someone guide me through this? "
17,2018-02-16 16:23:08,1518790988.0,kaggle,SQL Scavenger kaggle,7xz10w,ibrxk,,https://www.reddit.com/r/kaggle/comments/7xz10w/sql_scavenger_kaggle/,1.0,0.0,0.0,,"Hi I am new to kaggle and I just joined the competition too late, as this is the last day I just wanted to share with you my modest kernel manipulating data with BigQuery and pandas, knowing that this is my first kernel , I just need some support from your part, thanks. 
https://www.kaggle.com/ibrahimkochbati/analysis-sql-scavenger-hunt-day-1-my-first-kernel"
18,2018-02-18 19:22:52,1518974572.0,kaggle,Why so some people have a score of 100% on the Titanic dataset challenge ?,7yfnw0,hyperqube12,,https://www.reddit.com/r/kaggle/comments/7yfnw0/why_so_some_people_have_a_score_of_100_on_the/,2.0,5.0,0.0,,"I was looking at the [Titanic dataset challenge leaderboard](https://www.kaggle.com/c/titanic/leaderboard) and there are 16 people with perfect 1.0 scores. How is that even possible, with a dataset of less than 1000 examples and a considerable amount of missing (NaN) values for attributes? "
19,2018-02-21 17:22:32,1519226552.0,kaggle,On 29th June 2010 someone just transacted 4000 bitcoins from his own address to his own address.. Still wondering why have a look at this kernel and upvote it you like it.,7z6ako,ibadia,,https://www.reddit.com/r/kaggle/comments/7z6ako/on_29th_june_2010_someone_just_transacted_4000/,1.0,0.0,0.0,,
20,2018-03-05 10:37:25,1520239045.0,kaggle,Competitions for beginners,824kat,Gva-lob,,https://www.reddit.com/r/kaggle/comments/824kat/competitions_for_beginners/,6.0,3.0,0.0,,"I am a beginner in ML. I have completed the Stanford course under Prof. Andrew Ng, and I'd like to put the skills I learnt to work. Where should I start?"
21,2018-03-10 23:00:41,1520715641.0,kaggle,Is there a dark color theme for Kaggle?,83hyoy,hyperqube12,,https://www.reddit.com/r/kaggle/comments/83hyoy/is_there_a_dark_color_theme_for_kaggle/,3.0,1.0,0.0,,"I use kernels (jupyter notebooks) a lot, mostly for study and getting new ideas. Is there a way to switch to a dark theme on kaggle, since reading for hours on a white background is really hurtful on the eyes ? "
22,2018-03-13 11:18:06,1520932686.0,kaggle,A dataset containing actual queries on bestBuy.com manually labled by human experts.,842sra,gajju3588,,https://www.reddit.com/r/kaggle/comments/842sra/a_dataset_containing_actual_queries_on_bestbuycom/,1.0,0.0,0.0,,
23,2018-03-15 19:50:22,1521136222.0,kaggle,How to use External Data Thread for Kaggle Toxic Comments competition ?,84ofja,Tony-Mike,,https://www.reddit.com/r/kaggle/comments/84ofja/how_to_use_external_data_thread_for_kaggle_toxic/,1.0,0.0,0.0,739.0,"Hi there !

I'm undergoing the [toxic comment classification](https://www.kaggle.com/c/jigsaw-toxic-comment-classification-challenge)competition and heard that, in order to get a better trained algorithm, one may use External Data such as [comments on Kaggle](https://www.reddit.com/r/datasets/comments/65o7py/updated_reddit_comment_dataset_as_torrents/) for instance ;)

My question was how may I use external data to use it to train my database ? Indeed, my official train.csv file looks like :

     ['id', 'comment_text', 'toxic', 'severe_toxic', 'obscene', 'threat', 'insult', 'identity_hate']
     ['0000997932d777bf', ""Explanation\nWhy the edits made under my username Hardcore Metallica Fan were reverted? They weren't vandalisms, just closure on some GAs after I voted at New York Dolls FAC. And please don't remove the template from the talk page since I'm retired now.89.205.38.27"", '0', '0', '0', '0', '0', '0']
     ...

when being showed with Python and other website's database are surely not structured the same way ^^

"
24,2018-03-16 20:32:32,1521225152.0,kaggle,"what is your personal list of the 10 most important _fundamental_ , canonical data science problems that a beginner should address?",84xo6h,ezeeetm,,https://www.reddit.com/r/kaggle/comments/84xo6h/what_is_your_personal_list_of_the_10_most/,7.0,0.0,0.0,761.0,
25,2018-03-21 08:52:05,1521615125.0,kaggle,Buying Kaggle Accounts,8603ss,throwawaythro224119,,https://www.reddit.com/r/kaggle/comments/8603ss/buying_kaggle_accounts/,0.0,4.0,0.0,772.0,Account must have been created in the past (can't have been created recently). PM for details and price.
26,2018-03-21 21:40:29,1521661229.0,kaggle,Numerai giving out $450 in Numeraire ($NMR) to Kaggle users who sign up,8653x8,lbys,,https://www.reddit.com/r/kaggle/comments/8653x8/numerai_giving_out_450_in_numeraire_nmr_to_kaggle/,0.0,1.0,0.0,772.0,
27,2018-03-23 15:15:19,1521810919.0,kaggle,I am buying kaggle accounts!,86kj63,Jeyhoon,,https://www.reddit.com/r/kaggle/comments/86kj63/i_am_buying_kaggle_accounts/,0.0,2.0,0.0,779.0,"Hi,

I am buying your accounts opened before 18 March. The size of the account is not important. It may be an old account that you do not use. If you are interesting, you can be pm or mail (jhoonbtc@gmail.com) !

Note: It is not scam. Real!"
28,2018-04-02 07:55:04,1522644904.0,kaggle,Kiva Challenge: A beginner's submission,88wxll,ddigges,,https://www.reddit.com/r/kaggle/comments/88wxll/kiva_challenge_a_beginners_submission/,2.0,0.0,0.0,797.0,
29,2018-04-02 20:24:52,1522689892.0,kaggle,goo.gl/R9T623,891qmx,poonamV,,https://www.reddit.com/r/kaggle/comments/891qmx/googlr9t623/,0.0,0.0,0.0,799.0,
30,2018-04-08 01:54:04,1523141644.0,kaggle,How to score 0.8134 in Titanic Kaggle Challenge,8altms,ahmedbesbes,,https://www.reddit.com/r/kaggle/comments/8altms/how_to_score_08134_in_titanic_kaggle_challenge/,6.0,1.0,0.0,808.0,
31,2018-04-08 17:11:23,1523196683.0,kaggle,"[Python] Data analysis of house prices with pandas, matplotlib and Seaborn",8aq5ka,tomahim,,https://www.reddit.com/r/kaggle/comments/8aq5ka/python_data_analysis_of_house_prices_with_pandas/,2.0,0.0,0.0,809.0,
32,2018-04-08 17:25:53,1523197553.0,kaggle,Looking for a teammate for kaggle,8aq8gm,alhparsa,,https://www.reddit.com/r/kaggle/comments/8aq8gm/looking_for_a_teammate_for_kaggle/,4.0,7.0,0.0,809.0,"Hi everyone,

I have a decent background about machine learning, but I don't have anyone to work with. I was wondering if there is anyone here who is looking for a teammate to work on the competitions with me? "
33,2018-04-11 15:18:59,1523449139.0,kaggle,"New to ML, would love to get a feedback on Kernel (Tree-based Models)",8bglyn,ruslankl,,https://www.reddit.com/r/kaggle/comments/8bglyn/new_to_ml_would_love_to_get_a_feedback_on_kernel/,4.0,2.0,0.0,825.0,
34,2018-04-13 07:24:19,1523593459.0,kaggle,Completed competitions - beginner level using Keras,8bwi8z,Jeriko_One,,https://www.reddit.com/r/kaggle/comments/8bwi8z/completed_competitions_beginner_level_using_keras/,1.0,1.0,0.0,831.0,"are there any completed competitions you would recommend, that are of a beginner to intermediate level, include solutions with full code and descriptions, (hopefully include forum discussion), at least one top solution using keras?"
35,2018-04-21 18:36:53,1524325013.0,kaggle,"The first article in a series exploring Deep Learning in Computer Vision using PyTorch. In this, we set the goal of getting into the top 1% in a Kaggle Competition (you need to be in top 10% to be an expert)",8dwham,databiryani,,https://www.reddit.com/r/kaggle/comments/8dwham/the_first_article_in_a_series_exploring_deep/,10.0,1.0,0.0,854.0,
36,2018-05-02 04:45:09,1525225509.0,kaggle,CERN Challenge - LFG,8gdrs0,Flying_madman,,https://www.reddit.com/r/kaggle/comments/8gdrs0/cern_challenge_lfg/,2.0,2.0,0.0,886.0,Is anyone else working on the new CERN dataset? I'm looking for a group. 
37,2018-05-03 18:31:19,1525361479.0,kaggle,"[PyTorch for Computer Vision 2]: GPU in Deep Learning, do you need one?",8gr8ho,databiryani,,https://www.reddit.com/r/kaggle/comments/8gr8ho/pytorch_for_computer_vision_2_gpu_in_deep/,1.0,0.0,0.0,889.0,
38,2018-05-03 23:53:18,1525380798.0,kaggle,Titanic dataset. DNN issue.,8gtorn,iasktitanicquestions,,https://www.reddit.com/r/kaggle/comments/8gtorn/titanic_dataset_dnn_issue/,1.0,0.0,0.0,889.0,"I am currently building a triple-layered DNN to solve the Titanic Dataset problem. While building the model, I get the following error:

   targets[3] is out of range
My code can be accessed through my github account: https://github.com/isaac-altair/Titanic-Dataset/blob/master/Titanic%2BProject.ipynb

Thank you"
39,2018-05-04 09:42:50,1525416170.0,kaggle,My Kaggle Kernels rarely load.,8gx92u,SenatorDicknose,,https://www.reddit.com/r/kaggle/comments/8gx92u/my_kaggle_kernels_rarely_load/,1.0,1.0,0.0,889.0,"I can't see any indication that I am waiting in a queue.  Instead, I just see a loading icon spin around and an hour later the kernel gives me an error.  Anybody know what the problem is?  

Thanks."
40,2018-05-11 21:16:07,1526062567.0,kaggle,Super noob,8ipxp8,lukethedukeinsa,,https://www.reddit.com/r/kaggle/comments/8ipxp8/super_noob/,5.0,8.0,0.0,907.0,"Hi all been umming and aaaing (if that’s even a thing) for awhile about picking up data analysis / data science as a hobby. Stumbled across Kaggle (yep, late adopter here...)  and I like the concept - I just need to learn the basics. I’ve read about prof Ng’s course and: 

1. Is this it ? [course](http://openclassroom.stanford.edu/MainFolder/CoursePage.php?course=MachineLearning)

2. Any other courses tour suggest I check out? I have zero experience in programming python etc.

Basically starting from zero so be gentle...! TIA"
41,2018-05-13 19:11:39,1526227899.0,kaggle,Google / aws in kaggle notebooks,8j4u9a,mibca,,https://www.reddit.com/r/kaggle/comments/8j4u9a/google_aws_in_kaggle_notebooks/,2.0,1.0,0.0,909.0,Hi guys. I was looking for a way to link a Google cloud or aws account to a kaggle kernel. Any help?
42,2018-05-19 16:22:01,1526736121.0,kaggle,Working with 50GB+ training sets,8kl87q,zalias_was_taken,,https://www.reddit.com/r/kaggle/comments/8kl87q/working_with_50gb_training_sets/,5.0,3.0,0.0,922.0,Does anyone have tips on working with massive training sets (like the Avito or TrackML challenge) without a big AWS budget? Or is downsampling my only option?
43,2018-05-24 21:55:01,1527188101.0,kaggle,[Kaggle] Youtube Trending Videos - Detailed ANALYSIS (EDA),8lv5gc,SGonRedd,,https://www.reddit.com/r/kaggle/comments/8lv5gc/kaggle_youtube_trending_videos_detailed_analysis/,6.0,1.0,0.0,936.0,
44,2018-06-06 13:13:46,1528280026.0,kaggle,MNIST level-2 [OC],8ozg7f,backalla,,https://www.reddit.com/r/kaggle/comments/8ozg7f/mnist_level2_oc/,1.0,0.0,0.0,964.0,
45,2018-06-10 23:45:08,1528663508.0,kaggle,Late submission to a problem,8q3qbv,eloy1969,,https://www.reddit.com/r/kaggle/comments/8q3qbv/late_submission_to_a_problem/,1.0,1.0,0.0,968.0,"I've tried to submit my solution but it says  

""Our workers are spending a little extra time on your submission. Grab a coffee and refresh later to see your score.""

I've waited for a while but nothing happens. What could be the issue, is it possible to see my score?"
46,2018-06-25 23:38:39,1529959119.0,kaggle,Biological sciences datasets.,8tty1t,maxwellian_daemon,,https://www.reddit.com/r/kaggle/comments/8tty1t/biological_sciences_datasets/,3.0,3.0,0.0,1009.0,"Howdy guys, I am both looking for good biological sciences datasets and hoping to eventually contribute with good biological sciences datasets of my own.   Can you link me to the datasets that are publically available.  Whenever I find datasets, they tend to be associated with classroom work.  Thank you.

\- Emma"
47,2018-07-19 21:22:49,1532024569.0,kaggle,"Hi, I am a Beginner in the field of Data-Science &amp; also at Kaggle",908dmr,SalRite,,https://www.reddit.com/r/kaggle/comments/908dmr/hi_i_am_a_beginner_in_the_field_of_datascience/,1.0,0.0,0.0,1068.0,
48,2018-07-20 20:52:49,1532109169.0,kaggle,Training multi class classifiers with Imbalanced data,90i681,new00b,,https://www.reddit.com/r/kaggle/comments/90i681/training_multi_class_classifiers_with_imbalanced/,1.0,1.0,0.0,1067.0,"Hi,

I am new to Kaggle and have started doing the competitions recently. But, whenever I try to do a multi class classifier 

contest, the model I create always ends up predicting just one or two of the target variables. For eg, if suppose my training dataset contains 700 records for target class 1, 300 records for class2 and the remaining 12 classes contains less than 50 training examples, the model I train always predicts class1 or 2. Is there anyway to overcome this and ensure that the model predicts all classes in a better way ?"
49,2018-07-27 02:28:40,1532647720.0,kaggle,Account blocked and need help!,927cul,ddos,,https://www.reddit.com/r/kaggle/comments/927cul/account_blocked_and_need_help/,1.0,0.0,0.0,1085.0," **A total of 46 students are taking a probability course. 19 are majoring in mathematics, 20 in statistics, 20 in finance, 9 majoring in mathematics and statistics, 6 majoring in mathematics and finance, 5 majoring in statistics and finance, and 2 majoring in all three. What is the number of people not majoring in either mathematics, statistics, or finance?** "
50,2018-07-27 11:08:32,1532678912.0,kaggle,Website is not working!!,92anxd,tzersh,,https://www.reddit.com/r/kaggle/comments/92anxd/website_is_not_working/,1.0,0.0,0.0,1086.0,"Am the only one getting  500 error?

## 500 - The request timed out.

The web server failed to respond within the specified time. "
51,2018-07-30 11:36:20,1532939780.0,kaggle,First attempt to create a tutorial on biostatistics using R. Would love to hear any feedback or questions related to the subject.,932ddj,ruslankl,,https://www.reddit.com/r/kaggle/comments/932ddj/first_attempt_to_create_a_tutorial_on/,5.0,2.0,2.0,1091.0,
52,2018-08-03 12:00:23,1533286823.0,kaggle,"Dataset containing 10,000 images for all the Generation One Pokémon.",947zqz,the-dagger,,https://www.reddit.com/r/kaggle/comments/947zqz/dataset_containing_10000_images_for_all_the/,9.0,2.0,0.0,1112.0,
53,2018-08-10 08:31:43,1533879103.0,kaggle,Anyone else having trouble signing in on Chrome?,9646yg,cryinjordan,,https://www.reddit.com/r/kaggle/comments/9646yg/anyone_else_having_trouble_signing_in_on_chrome/,1.0,1.0,0.0,4100.0,"Hi all, for some reason I cannot log in when I use the Chrome browser. It works just fine when I use Safari or Firefox. Anyone else encounter this? Someone know a fix?"
54,2018-08-14 02:30:30,1534203030.0,kaggle,Dataset of 257K Gaia DR2 stars + data cleanup kernels,973bdq,j-solorzano,,https://www.reddit.com/r/kaggle/comments/973bdq/dataset_of_257k_gaia_dr2_stars_data_cleanup/,2.0,0.0,0.0,1144.0,"[257K Gaia DR2 Stars](https://www.kaggle.com/solorzano/257k-gaia-dr2-stars#257k-gaiadr2-sources-with-photometry.csv) is a Kaggle dataset that contains data from Gaia DR2 (parallax/distance, magnitude) and cross-identified photometry from GSC 2.3, PPMXL, Tycho2, 2MASS and AllWISE. I also posted a couple of related data cleanup kernels:

[Removal of Gaia DR2 Stars With Apparent Systematic](https://www.kaggle.com/solorzano/removal-of-gaia-dr2-stars-with-apparent-systematic)

[Position Bias Correction for Stellar Magnitude DBs](https://www.kaggle.com/solorzano/position-bias-correction-for-stellar-magnitude-dbs)"
55,2018-08-27 21:40:17,1535395217.0,kaggle,what's different between kaggle jupyter and google colab?,9arklv,asda43asdf23423,,https://www.reddit.com/r/kaggle/comments/9arklv/whats_different_between_kaggle_jupyter_and_google/,2.0,3.0,0.0,1182.0,
56,2018-08-30 09:17:20,1535609840.0,kaggle,Using Kaggle to guide your learning: Why and How should you start?,9bh5ur,Zeolearn,,https://www.reddit.com/r/kaggle/comments/9bh5ur/using_kaggle_to_guide_your_learning_why_and_how/,3.0,0.0,0.0,1197.0," 

Let me introduce Kaggle and clear some misconceptions about it.

You have probably heard of the [mind-boggling cash prizes](https://www.forbes.com/sites/ryanholiday/2012/04/16/what-the-failed-1m-netflix-prize-tells-us-about-business-advice/#41eec71d73c9) that some Kaggle competitions award. Or maybe, some argument on how far its competitions are from the “real” data science work. Or, maybe you have subscribed to Kaggle email alerts and that last competition announcement finally made you wanna try to get a piece of the pie.

 "
57,2018-09-09 14:24:35,1536492275.0,kaggle,What does the score next to versions mean?,9ecadc,FamiliarSecond,,https://www.reddit.com/r/kaggle/comments/9ecadc/what_does_the_score_next_to_versions_mean/,1.0,1.0,0.0,1230.0,"I have just started using Kaggle and to be fair it isn't that well documented. I can't find an explanation of the (+x/-y) parameter under the Versions tab of a notebook.

&amp;#x200B;

I assume it's some kind of score which measures how far you are from the right prediction. Maybe the +x is how many values I have overestimated more than a certain threshold and the -y how many values I have underestimated.

&amp;#x200B;

However, I still can't understand it. My first version had (+9/-9) and a public score of 0.11641 while my second version had a lower ""rating"" (+2/-2) but got a worse public score of 0.12295

&amp;#x200B;

Does anyone know what (+x/-y) means and how it is correlated to score? For the record, my scores are from the starter ""House Prices"" dataset."
58,2018-09-17 16:06:41,1537189601.0,kaggle,Kernel - Reshape &amp; Summarize (Pivot Table) in Pandas,9gk5cu,aakashkh284,,https://www.reddit.com/r/kaggle/comments/9gk5cu/kernel_reshape_summarize_pivot_table_in_pandas/,2.0,0.0,0.0,1248.0,"Today I created a Kaggle Kernel via Python for analyzing the LA Restaurant &amp; Market Health Data.

[https://www.kaggle.com/aakashkh/reshape-summarize-pivot-table-in-pandas](https://www.kaggle.com/aakashkh/reshape-summarize-pivot-table-in-pandas)

I came up with some useful Python tools for grouping, reshaping, pivoting and making Box-plot and Violin Charts.

I am still working on it and updating the Kernel and open to new ideas on how to further transforming and visualizing to enrich the analysis on the same data set."
59,2018-09-22 00:18:41,1537564721.0,kaggle,ye,9hu533,mmstingray5,,https://www.reddit.com/r/kaggle/comments/9hu533/ye/,1.0,1.0,0.0,1263.0,I love kaggle!!!
