,created_date,created_timestamp,subreddit,title,id,author,author_created_utc,full_link,score,num_comments,num_crossposts,subreddit_subscribers,post
240,2020-03-19 06:41:16,1584592876.0,kaggle,Two new Kaggle competitions to predict/reduce spread of COVID-19,fl42i5,MediocrePaladin,,https://www.reddit.com/r/kaggle/comments/fl42i5/two_new_kaggle_competitions_to_predictreduce/,1.0,1.0,0.0,3466.0,"""While the challenge involves forecasting confirmed cases and fatalities between March 25 and April 22 by region, the primary goal **isn't to produce accurate forecasts**. It’s to identify factors that appear to impact the transmission rate of COVID-19.""

Datasets sourced and models built for this competition may also help address [**key open scientific questions**](https://www.kaggle.com/allen-institute-for-ai/CORD-19-research-challenge/tasks) on COVID-19. Some examples include:

* [**What do we know about non-pharmaceutical interventions?**](https://www.kaggle.com/allen-institute-for-ai/CORD-19-research-challenge/tasks?taskId=587) Collecting rich datasets of policy actions taken and when they were taken (school closures, cancelling large gatherings, stay-at-home, etc.) and measuring their impact on downstream infection rates will be important to forward forecast of case volumes and answering this question
* [**What is known about transmission, incubation, and environmental stability?**](https://www.kaggle.com/allen-institute-for-ai/CORD-19-research-challenge/tasks?taskId=568) Data feeding into predictive models on transmission probabilities and incubation times may also help address this
* [**What do we know about COVID-19 risk factors?**](https://www.kaggle.com/allen-institute-for-ai/CORD-19-research-challenge/tasks?taskId=558) Data to forecast severe cases that are likely to lead to fatalities across regions of varying demographics will also help enlighten COVID-19 risk factors
* [**What has been published about medical care?**](https://www.kaggle.com/allen-institute-for-ai/CORD-19-research-challenge/tasks?taskId=572) Data on local healthcare system capacity, approaches, and results for COVID-19 patients will be helpful to understand if and when hospital systems will be strained, and how systems can optimize care

You are encouraged to pull in, curate and share data sources that might be helpful. ""

Links:

[https://kaggle.com/c/covid19-global-forecasting-week-1](https://kaggle.com/c/covid19-global-forecasting-week-1)

[https://kaggle.com/c/covid19-local-us-ca-forecasting-week-1](https://kaggle.com/c/covid19-local-us-ca-forecasting-week-1)"
241,2020-03-19 23:40:34,1584654034.0,kaggle,Waymo blog: Announcing Waymo’s Open Dataset Competitions,flifcb,GreenTeaOnMyDesk,,https://www.reddit.com/r/kaggle/comments/flifcb/waymo_blog_announcing_waymos_open_dataset/,1.0,0.0,0.0,3469.0,
242,2020-03-20 20:06:39,1584727599.0,kaggle,"Shameless self-promotion of my research project - the ""Killer Shrimp Invasion Challenge"". A simple Kaggle competition designed to predict spread of aquatic invasive species, incl. small monetary price (Mods, hope posting this is okay)",flzmq0,wallekaffe,,https://www.reddit.com/r/kaggle/comments/flzmq0/shameless_selfpromotion_of_my_research_project/,1.0,0.0,0.0,3475.0,
243,2020-03-22 19:15:41,1584897341.0,kaggle,Coronavirus Search Engine for COVID-19 Research Papers,fn352n,mrnerdy59,,https://www.reddit.com/r/kaggle/comments/fn352n/coronavirus_search_engine_for_covid19_research/,1.0,1.0,0.0,3482.0,"Just thought of making all kaggle data of COVID-19 searchable for easier research among 30,000 articles. 

You may even try asking questions to any article

https://covid19.deepneurals.com/

What are your thoughts?"
244,2020-03-23 03:36:59,1584927419.0,kaggle,M5 forecasting competition,fnbke6,sweetpotatowedge9,,https://www.reddit.com/r/kaggle/comments/fnbke6/m5_forecasting_competition/,1.0,0.0,0.0,3483.0,"I made a video comparing several intuitive forecasting methods, compared them using a local implementation of WRMSSE, and submitted submission.csv from the Kaggle kernel. If anyone's interested link to the video is here: https://youtu.be/HnLiVutur8A

And link to the Notebook where the code is stored: https://www.kaggle.com/qcw171717/other-naive-forecasts-submission-score

Overall, I am pretty surprised by how these simple methods are not terrible, one of them actually does pretty decent for a first attempt. I think I'll start trying an ML model once I figure out a way to get around this memory problem.."
245,2020-03-25 17:32:30,1585150350.0,kaggle,Killer Shrimp Invasion Challenge,fos9of,polymaximus,,https://www.reddit.com/r/kaggle/comments/fos9of/killer_shrimp_invasion_challenge/,1.0,0.0,0.0,3494.0,"Have a look at our challenge: [https://www.kaggle.com/c/killer-shrimp-invasion](https://www.kaggle.com/c/killer-shrimp-invasion)  


The goal of this challenge is to spur researchers around the world to build innovative machine learning solutions to help monitoring and prediction of invasive species. The challenge focuses on one specific species, the so-called ""Killer Shrimp"" ([Dikerogammarus Villosus](https://en.wikipedia.org/wiki/Dikerogammarus_villosus)), and its spread in the Baltic Sea. The results can be applied to other species as well.

&amp;#x200B;

https://preview.redd.it/er1t8wq78uo41.png?width=383&amp;format=png&amp;auto=webp&amp;s=0923ddcf849d7ce79549fd25d1b509ebe0d203fa

The *Kaggle Killer Shrimp Invasion Challenge* invites you to try your hand at tackling this global problem with data and machine learning! Through your submissions, you will not only build an algorithm, but also help protect the ocean. Plus the winner will receive a monetary prize and the opportunity to present their solution to ODF and its partners!"
246,2020-03-26 20:37:59,1585247879.0,kaggle,John Snow LabsTeam is Excited to Support #BuildforCOVID19 Global Online Hackathon,fpgz3q,johnsnowlabsUS,,https://www.reddit.com/r/kaggle/comments/fpgz3q/john_snow_labsteam_is_excited_to_support/,1.0,0.0,0.0,3500.0," John Snow Labs team is eager to join the #BuildforCOVID19 Global Online Hackathon. To support innovators around the world, we are making all of our licensed software – Spark NLP for Healthcare, the Healthcare AI Platform, and the Curated Datasets – available for free. If you’re also looking for an air-gap, end-to-end AI platform for analyzing PHI at scale, our Healthcare AI Platform is freely available as well. You have our commitment to uninterrupted service and support during these hectic times. 

&amp;#x200B;

https://preview.redd.it/t6gbtdq9a2p41.png?width=940&amp;format=png&amp;auto=webp&amp;s=3413985eae655b8da12c41e300bd66abe6c9a911

Sign up for the hackathon here: [https://covid-global-hackathon.devpost.com/](https://covid-global-hackathon.devpost.com/) and get your free licenses here: [https://www.johnsnowlabs.com/fight-covid-19-with-john-snow-labs](https://www.johnsnowlabs.com/fight-covid-19-with-john-snow-labs/?utm_campaign=COVID-19&amp;utm_source=hs_email&amp;utm_medium=email&amp;_hsenc=p2ANqtz--F8ij3wY6vztOqvF1T7s6ktFn1c__gzz4GU6BLt7vfmLvBHQ8hUPytpZMVzKFfqLcrghDz)"
247,2020-03-28 02:19:22,1585354762.0,kaggle,3500 News Articles about Coronavirus till March 26,fq9ees,StandardDisk3,,https://www.reddit.com/r/kaggle/comments/fq9ees/3500_news_articles_about_coronavirus_till_march_26/,1.0,0.0,0.0,3505.0,"Includes basically all of the articles from CBC news website. 

### Context

Has the news media been overreacting or under-reacting during the development of COVID-19? What are the media's main focuses? How is the news correlated to public reactions or policy changes? You might find many insights with more than 3,500 CBC news articles.

[https://www.kaggle.com/ryanxjhan/cbc-news-coronavirus-articles-march-26](https://www.kaggle.com/ryanxjhan/cbc-news-coronavirus-articles-march-26)

https://preview.redd.it/6mu6k8v44bp41.jpg?width=1600&amp;format=pjpg&amp;auto=webp&amp;s=840bc36e58ef4dde2f58ecb4c2e83ef27745e22a"
248,2020-04-02 06:43:13,1585798993.0,kaggle,Looking for a team.,ftf9f5,joshuatyler-a,,https://www.reddit.com/r/kaggle/comments/ftf9f5/looking_for_a_team/,1.0,1.0,0.0,3540.0,"Hey there,

&amp;#x200B;

I'm a data science novice with a small working knowledge in report dev (MySQL, Redshift, PostgreSQL, etc., and Crystal Reports.) 

I was wondering if there are any teams looking for someone who can learn and adapt quickly in competitions. 

&amp;#x200B;

Thanks"
249,2020-04-02 11:47:43,1585817263.0,kaggle,Sweden COVID-19 Dataset,ftivm5,polymaximus,,https://www.reddit.com/r/kaggle/comments/ftivm5/sweden_covid19_dataset/,1.0,0.0,0.0,3541.0,"New dataset specifically for Sweden to track and predict its development during the pandemic. It is an interesting case study as Sweden's approach has been quite distinct from the rest of Europe thus far.  

[https://www.kaggle.com/jannesggg/sweden-covid19-dataset](https://www.kaggle.com/jannesggg/sweden-covid19-dataset)"
250,2020-04-05 01:19:41,1586038781.0,kaggle,"A Relaxing Timelapse of Titanic Competition Winner Notebook (self-promo, sorry)",fv2jjh,silverwood2,,https://www.reddit.com/r/kaggle/comments/fv2jjh/a_relaxing_timelapse_of_titanic_competition/,1.0,2.0,0.0,3565.0,
251,2020-04-05 22:23:29,1586114609.0,kaggle,New notebook on how public transport usage is correlated with COVID-19,fvjklj,trevornell,,https://www.reddit.com/r/kaggle/comments/fvjklj/new_notebook_on_how_public_transport_usage_is/,1.0,0.0,0.0,3570.0,
252,2020-04-06 01:32:12,1586125932.0,kaggle,Neural Style Transfer - Can artificial intelligence draw pictures like picasso?,fvmw0k,emrectn,,https://www.reddit.com/r/kaggle/comments/fvmw0k/neural_style_transfer_can_artificial_intelligence/,1.0,0.0,0.0,3571.0,"Hello my friend.  If you are interested in deep learning, check out the link to learn about Neural Style Transfer and try it out.  Artificial intelligence drew my dog's picture like Van Gogh. You can see the change epoch by epoch. For more, visit my kernel. If you like it please upvote the kernel.

It is my first kernel and I am waiting for your suggestions and criticisms to develop better.

&amp;#x200B;

https://preview.redd.it/mp9szvigt2r41.jpg?width=1083&amp;format=pjpg&amp;auto=webp&amp;s=4e062fd1b6b6305422cde6cc108d9d557681ac80

[https://www.kaggle.com/emrecetin/neural-style-transfer](https://www.kaggle.com/emrecetin/neural-style-transfer)"
253,2020-04-11 03:35:02,1586565302.0,kaggle,Turn your selfies into an anime character using Ainize,fysss9,Jenny4182,,https://www.reddit.com/r/kaggle/comments/fysss9/turn_your_selfies_into_an_anime_character_using/,1.0,0.0,0.0,3598.0,[https://medium.com/ai-network/ainize-it-turn-your-selfies-into-an-anime-character-using-an-ai-open-source-project-1abb6229d83d](https://medium.com/ai-network/ainize-it-turn-your-selfies-into-an-anime-character-using-an-ai-open-source-project-1abb6229d83d)
254,2020-04-12 17:44:34,1586702674.0,kaggle,Please help. The q_4.check() of geospatial analysis is showing an error. This is what it says 👇,fzxwo3,PMR4206,,https://www.reddit.com/r/kaggle/comments/fzxwo3/please_help_the_q_4check_of_geospatial_analysis/,1.0,1.0,0.0,3612.0,
255,2020-04-14 06:47:20,1586836040.0,kaggle,Geo-spacial analysis sources for maps,g0y8xs,skrillavilla,,https://www.reddit.com/r/kaggle/comments/g0y8xs/geospacial_analysis_sources_for_maps/,3.0,3.0,0.0,3628.0,"When working the Geo-spacial analysis course I often saw code like the block below used to pull in maps of regions.

    # Load a GeoDataFrame containing regions in Ghana regions = gpd.read_file(""../input/geospatial-learn-course-data/ghana/ghana/Regions/Map_of_Regions_in_Ghana.shp"") print(regions.crs) 

My question is where can I find maps like these for use in my own notebooks. For example a map of all the US states? Any help is greatly appreciated."
256,2020-04-18 09:06:04,1587189964.0,kaggle,7 Model Analysis of Titanic Dataset (XGBoost),g3ip0e,ankuchak,,https://www.reddit.com/r/kaggle/comments/g3ip0e/7_model_analysis_of_titanic_dataset_xgboost/,1.0,0.0,0.0,3636.0,
257,2020-04-20 01:43:04,1587336184.0,kaggle,Do any of you work as a freelancer in datascience?,g4h2i6,some_dadaism,,https://www.reddit.com/r/kaggle/comments/g4h2i6/do_any_of_you_work_as_a_freelancer_in_datascience/,1.0,6.0,0.0,3640.0,Do you sometimes work on projects for clients outside from Kaggle?
258,2020-04-24 21:10:44,1587751844.0,kaggle,A Simple Machine Learning Project Since Data Collect until deploy with Python and Django,g7ddz0,diegopmayer,,https://www.reddit.com/r/kaggle/comments/g7ddz0/a_simple_machine_learning_project_since_data/,1.0,0.0,0.0,3658.0,
259,2020-04-25 03:02:51,1587772971.0,kaggle,"M5 Competition: Time Series Transformation, LightGBM, and a local WRMSSE",g7jmrx,sweetpotatowedge9,,https://www.reddit.com/r/kaggle/comments/g7jmrx/m5_competition_time_series_transformation/,1.0,0.0,0.0,3661.0,"Another attempt at Kaggle's M5 forecasting competition, this time finally taking a common ML approach. For those without context, the data is given with each (product, store, sales from 1000+ days) as one row, and in order for us to do interesting feature engineering we need for it to be (product, store, day number x, sales) for each day. So this Notebook is about how such time series transformations can be implemented and how to create lag features after the transformation.

There is also a local WRMSSE calculation in this Notebook that matches with the leaderboard score, so we don't have to submit to see the actual model performance.

The notebook where this is implemented: [https://www.kaggle.com/qcw171717/time-series-transformation](https://www.kaggle.com/qcw171717/time-series-transformation)

And I made a video explaining this as well: [https://youtu.be/iU3HhKH325g](https://youtu.be/iU3HhKH325g)"
260,2020-04-25 05:56:54,1587783414.0,kaggle,[P] Restore and colorize monochrome images!,g7m7jr,Jenny4182,,https://www.reddit.com/r/kaggle/comments/g7m7jr/p_restore_and_colorize_monochrome_images/,1.0,0.0,0.0,3661.0,
261,2020-04-30 01:27:49,1588199269.0,kaggle,Understanding Amazon from Space Challenge,gaj9wv,AdlerRezagada,,https://www.reddit.com/r/kaggle/comments/gaj9wv/understanding_amazon_from_space_challenge/,1.0,1.0,0.0,3696.0,"Hi! As it turns out I'm working on this [challenge](https://www.kaggle.com/c/planet-understanding-the-amazon-from-space/overview) for one of my classes. However, I just found out that the Torrent used for download the dataset is down (apparently there is not seeds anymore).

Does anybody have this dataset? I found an older version but that one doesn't have the images in .tif format, and it doesn't have the Infrared information. 

I'll be really grateful if anyone know where I can find this dataset."
262,2020-04-30 20:29:12,1588267752.0,kaggle,Kaggle Group,gb0577,Anunoby3,,https://www.reddit.com/r/kaggle/comments/gb0577/kaggle_group/,1.0,0.0,0.0,3700.0,"Looking to make a slack group where we work on a new kaggle challenge every week.

Everyone posts their solutions and we discuss best practices and how to improve our models.

This would be a learning group where everyone can focus on improving.

Pm me to join"
263,2020-05-01 14:38:42,1588333122.0,kaggle,"Deploy your own Deep Learning COVID-19 detector for X-rays! I did this to reflect how easy it is today to help each other at scale using the idea of Crowdsourcing. Crowdsourcing can be a powerful tool, like the show 'Diagnosis' on Netflix. If you succeed in deploying yours, pls upvote the notebook!",gbgin5,trevornell,,https://www.reddit.com/r/kaggle/comments/gbgin5/deploy_your_own_deep_learning_covid19_detector/,1.0,0.0,0.0,3703.0,
264,2020-05-02 08:57:48,1588399068.0,kaggle,Does kaggle have a discord community?,gc1fwn,Timoteyo,,https://www.reddit.com/r/kaggle/comments/gc1fwn/does_kaggle_have_a_discord_community/,1.0,0.0,0.0,3705.0,Excited to share my insights and my collected data
265,2020-05-03 07:23:36,1588479816.0,kaggle,Looking for a team of ML enthusiasts.,gckhsh,violet_parr27,,https://www.reddit.com/r/kaggle/comments/gckhsh/looking_for_a_team_of_ml_enthusiasts/,1.0,11.0,0.0,3709.0,"Hi, I am a Business Analytics student with specialization in Data Science, due to COVID-19 my summer internship gog cancelled. I am looking for teammates who are enthusiastic about ML and Data science to team up for Kaggle competition. 

I am fluent in R and comfortable with Python."
266,2020-05-03 14:13:48,1588504428.0,kaggle,Exchange of up-votes of kaggle notebooks/datasets,gcovyh,mmeeh,,https://www.reddit.com/r/kaggle/comments/gcovyh/exchange_of_upvotes_of_kaggle_notebooksdatasets/,1.0,1.0,0.0,3719.0,"Send me a private message with your account link and I will reply with mine.

Cheerios"
267,2020-05-03 20:15:27,1588526127.0,kaggle,Kagoole (@kagoole) tweets when new kaggle competition is launched,gcu90c,qenv,,https://www.reddit.com/r/kaggle/comments/gcu90c/kagoole_kagoole_tweets_when_new_kaggle/,1.0,0.0,0.0,3724.0,
268,2020-05-07 16:40:13,1588858813.0,kaggle,Searching for Teammates!,gf6qd1,pusheen3222,,https://www.reddit.com/r/kaggle/comments/gf6qd1/searching_for_teammates/,1.0,10.0,0.0,3742.0,"I am a math major at Caltech with a minor in data science. I'm new to Kaggle (only participated in 1 competition), but I took two Caltech ML courses and am fairly familiar with TensorFlow, Pytorch, and OpenCV. I will be doing a research on the theoretical aspect of deep learning during the summer. Looking for teammates to do Kaggle competitions together!"
269,2020-05-09 21:47:57,1589050077.0,kaggle,Looking for team mates,ggl4lk,dataoveropinions,,https://www.reddit.com/r/kaggle/comments/ggl4lk/looking_for_team_mates/,1.0,12.0,0.0,3755.0,"My user name is lowecoryr

If interested, please dm me.

Thanks!"
270,2020-05-12 09:11:09,1589263869.0,kaggle,Easy steps to integrate Google Colab and Kaggle,gi5fxf,dikatok,,https://www.reddit.com/r/kaggle/comments/gi5fxf/easy_steps_to_integrate_google_colab_and_kaggle/,1.0,0.0,0.0,3773.0,
271,2020-05-12 19:11:35,1589299895.0,kaggle,Where begin in Kaggle?,gie7rd,rinojohn9025,,https://www.reddit.com/r/kaggle/comments/gie7rd/where_begin_in_kaggle/,1.0,2.0,0.0,3778.0,I'm in pursuit to become a data scientist. I recently got call saying that Kaggle competitions is the best way to seriously start your career as a data scientist.  Can somebody please tell the process through for it ?
272,2020-05-13 04:23:30,1589333010.0,kaggle,Do top tech companies recruit from Kaggle contest leaderboards?,gip0tw,TheGubbler,,https://www.reddit.com/r/kaggle/comments/gip0tw/do_top_tech_companies_recruit_from_kaggle_contest/,1.0,3.0,0.0,3783.0,
273,2020-05-14 00:06:36,1589403996.0,kaggle,Best Practices for Non-Python/R Solutions,gj7sfa,rkruegs123,,https://www.reddit.com/r/kaggle/comments/gj7sfa/best_practices_for_nonpythonr_solutions/,1.0,0.0,0.0,3786.0,"Do people have suggestions on the best way to submit a to a kaggle competition without using R or Python? How would one use a a particularly obscure language, like Haskell?"
274,2020-05-14 12:02:01,1589446921.0,kaggle,M5 Forecasting - Accuracy Competition,gjip0u,yogesh174,,https://www.reddit.com/r/kaggle/comments/gjip0u/m5_forecasting_accuracy_competition/,1.0,1.0,0.0,3788.0,"Sales prediction of 30,490 items across 10 stores in 3 states of US wallmart stores based on 2011-2016 historical sales data.

EDA -  [https://www.kaggle.com/yogesh174/wallmart-eda](https://www.kaggle.com/yogesh174/wallmart-eda) 

Prediction of single item across 10 stores using neural networks -   [https://www.kaggle.com/yogesh174/single-item-sales-prediction-nn](https://www.kaggle.com/yogesh174/single-item-sales-prediction-nn) 

Prediction of single item across 10 stores using ARIMA -   [https://www.kaggle.com/yogesh174/single-item-sales-prediction-arima](https://www.kaggle.com/yogesh174/single-item-sales-prediction-arima)"
275,2020-05-15 16:55:34,1589550934.0,kaggle,Guys i've made this kernel on Simple Pipelining and GridSearchCV which isn't a part of any competition. Can y'all check it out and give some votes if you like it.,gk9jl9,sixpathsrain,,https://www.reddit.com/r/kaggle/comments/gk9jl9/guys_ive_made_this_kernel_on_simple_pipelining/,1.0,2.0,0.0,3796.0,
276,2020-05-18 11:11:35,1589789495.0,kaggle,I'm looking for a member of the Kaggle team.,glxecf,marload,,https://www.reddit.com/r/kaggle/comments/glxecf/im_looking_for_a_member_of_the_kaggle_team/,1.0,0.0,0.0,3811.0,"Hello, I'm looking for a team member to participate in the Kaggle competition. I'm taking a leave of absence from a bachelor's course in South Korea and working as a Machine Learning Engineer. I am very interested in Reinforcement Learning and Computer Vision, and I read dozens of papers and implemented them using TensorFlow. I would like to participate mainly in the competition hosted by the International Conference. Also, if We get good grades, I want to write a paper together. For your information, I'm a beginner of Kaggle."
277,2020-06-01 11:52:48,1591001568.0,kaggle,How To Find Success In Kaggle: What Do The Masters Recommend,guh2ep,analyticsindiam,,https://www.reddit.com/r/kaggle/comments/guh2ep/how_to_find_success_in_kaggle_what_do_the_masters/,1.0,0.0,0.0,3887.0,
278,2020-06-01 14:36:21,1591011381.0,kaggle,Random observation about top kaggle rank holders,guj1il,saransh09,,https://www.reddit.com/r/kaggle/comments/guj1il/random_observation_about_top_kaggle_rank_holders/,1.0,5.0,0.0,3887.0,"I was looking at the Kaggle rankings today, to my surprise, majority of the top kaggle rank holders were Europeans. If we go by the regular educational reputation, and the kind of international student attention that USA gets, this should not be the case, in fact the top ranked American in Kaggle is Bojan (who is 12th right now).

There were surprisingly less number of Asian top rankers as well, which shouldn't be the case taking into account the population of countries like India and China.  
Any particular reason you could think of? Or is it just random?"
279,2020-06-02 10:45:22,1591083922.0,kaggle,Exporting Kaggle Mini Courses,gv2zbf,5k1rm15h,,https://www.reddit.com/r/kaggle/comments/gv2zbf/exporting_kaggle_mini_courses/,1.0,0.0,0.0,3890.0,"I'm looking for a way to export the mini courses into a python IDE. 

Is there a simple way to get all the code and the imported sources from kaggle into spyder?"
280,2020-06-05 13:30:00,1591353000.0,kaggle,Why Are Senior Data Scientists Missing From Kaggle?,gx220q,analyticsindiam,,https://www.reddit.com/r/kaggle/comments/gx220q/why_are_senior_data_scientists_missing_from_kaggle/,1.0,6.0,0.0,3904.0,
281,2020-06-08 22:26:12,1591644372.0,kaggle,Bacteria detection dataset now on Kaggle for learning image segmentation,gz5zw6,longuyen97,,https://www.reddit.com/r/kaggle/comments/gz5zw6/bacteria_detection_dataset_now_on_kaggle_for/,8.0,0.0,0.0,3931.0,"For my thesis in deep learning, I gathered and annotated (segmentation) almost 400 images. The dataset is published at  [https://www.kaggle.com/longnguyen2306/bacteria-detection-with-darkfield-microscopy](https://www.kaggle.com/longnguyen2306/bacteria-detection-with-darkfield-microscopy)

I also included a kernel on building UnetPlusPlus, a variant of UNet with more skip connections.

Any feedbacks are welcome.

&amp;#x200B;

&amp;#x200B;

https://preview.redd.it/z19nvg9lmq351.png?width=1665&amp;format=png&amp;auto=webp&amp;s=52ad532172584b9f955345afe1fbd0b62b888813

&amp;#x200B;

https://preview.redd.it/rsaiysslmq351.png?width=1618&amp;format=png&amp;auto=webp&amp;s=52d1e6c7cf1872fd66754d9a83c94a3a4ccc1dec

&amp;#x200B;

https://preview.redd.it/g65v8u9mmq351.png?width=1222&amp;format=png&amp;auto=webp&amp;s=1ad4a0b05cc125f2c596381196fc11e95407670a"
282,2020-06-10 17:18:07,1591798687.0,kaggle,Do teams participating in competition use high performance servers from cloud providers for training their model?,h0bwvo,_nikc,,https://www.reddit.com/r/kaggle/comments/h0bwvo/do_teams_participating_in_competition_use_high/,2.0,2.0,0.0,3933.0,"I was just curious to know how much a team will spend to compete in a competition and how much does using a high performance server helps in the competition.
I think most of them should be using the servers cause I see some competitions with some good prize money."
283,2020-06-12 11:05:52,1591949152.0,kaggle,A CFA Who Started As A Head Of Data Science: Interview With Kaggle Master Ilia Larchenko,h7gmbu,analyticsindiam,,https://www.reddit.com/r/kaggle/comments/h7gmbu/a_cfa_who_started_as_a_head_of_data_science/,4.0,0.0,0.0,3937.0,
284,2020-06-15 18:45:13,1592235913.0,kaggle,Research Paper Reading (small) Community,h9it65,poons-san,,https://www.reddit.com/r/kaggle/comments/h9it65/research_paper_reading_small_community/,1.0,1.0,0.0,3949.0,"Hi r/kaggle,

I am planning to set up a discord server/ slack workspace for reading, sharing and discussing research papers and implement them to some kaggle competitions/ datasets. I read my first research paper ([this one](https://arxiv.org/abs/1501.00092)) over the last weekend and implemented it in python. I thought it would be nice to have a small community to do this with. Direct me a message if you are interested. I intend to keep the member count below 5 (for now).

P.S.: I used to get daunted by the *greek* in the papers and still do. It is OK if you feel overwhelmed by it. And apologies for bad english.

Edit: If such a community already exists kindly direct me to it and ignore this post."
285,2020-06-19 22:40:24,1592595624.0,kaggle,Google Trends Financial Terms—Daily and Weekly Dataset,hc7an3,Skaaaaalll,,https://www.reddit.com/r/kaggle/comments/hc7an3/google_trends_financial_termsdaily_and_weekly/,2.0,0.0,0.0,3970.0,"[https://www.kaggle.com/cristianperezjensen/google-trends-financial-terms-daily-and-weekly](https://www.kaggle.com/cristianperezjensen/google-trends-financial-terms-daily-and-weekly)

&amp;#x200B;

Daily and Weekly data over the entire timeframe, which is usually only available in monthly data."
