,created_date,created_timestamp,subreddit,title,id,author,author_created_utc,full_link,score,num_comments,num_crossposts,subreddit_subscribers,post
104,2019-04-14 06:29:03,1555212543.0,kaggle,Data Sets Disappear When Committing?,bcyrki,jl303,,https://www.reddit.com/r/kaggle/comments/bcyrki/data_sets_disappear_when_committing/,2.0,0.0,0.0,2118.0,"I manually uploaded a data set file, and I can access the file in ../input/data\_set\_name/data.json when I run.

However, when I commit, it throws an error saying it can't find the file.

How can I access the file when committing?

Thanks!"
105,2019-04-15 09:02:31,1555308151.0,kaggle,How to save ouput of cells along with code and markup?,bdcngt,theprogrammingsteak,,https://www.reddit.com/r/kaggle/comments/bdcngt/how_to_save_ouput_of_cells_along_with_code_and/,1.0,1.0,0.0,2123.0,"I find that everytime i refresh my code the output gets deleted, how can I save this? and how does committing work?"
106,2019-04-15 14:23:09,1555327389.0,kaggle,Hey guys! I am a noobie to kaggle although i have experience in ML/DL so is anyone participating in a kaggle competition and looking for a team mate?,bdetdn,revant_t,,https://www.reddit.com/r/kaggle/comments/bdetdn/hey_guys_i_am_a_noobie_to_kaggle_although_i_have/,0.0,9.0,0.0,2123.0,"I would be more than happy to be a part of it as its a great learning opportunity
P.s It's my first post so kindly let me know if I did something wrong instead of downvoting"
107,2019-04-21 20:02:03,1555866123.0,kaggle,CareerCon Model Using Group Id's the Right Way!,bfqyr4,Death_Water,,https://www.reddit.com/r/kaggle/comments/bfqyr4/careercon_model_using_group_ids_the_right_way/,1.0,0.0,0.0,2149.0,"Hi All,

The post is specific  CareerCon Competition for Predicting the surface on which a robot is traversing using IMU sensor data.

I didn't see any of the Public Kernels using the group id's data other than making use of it for validation split in GroupShuffleSplit or GroupKFolds.

So i decided to come up with a model that reduces the modelling of group-specific patterns from the data and generalize well by focusing on surface-specific patterns in the data.

The basic idea is to do pair-wise comparison on random pairs from the training data and make the model predict if they belong to the same group and/or surface.

Here's a link to the Kernel : [Link](https://www.kaggle.com/abdurrafae/using-group-id-s-the-right-way)

Give it a view and let me know on how to improve further."
108,2019-04-24 12:29:51,1556098191.0,kaggle,beginner eda .Check out my eda if you like that please upvote,bgsjag,nauts30,,https://www.reddit.com/r/kaggle/comments/bgsjag/beginner_eda_check_out_my_eda_if_you_like_that/,2.0,0.0,0.0,2155.0,
109,2019-04-26 20:22:12,1556299332.0,kaggle,If you're looking to try a Kaggle competition I made a quick guide to get you started! :),bhoxh8,0_marauders_0,,https://www.reddit.com/r/kaggle/comments/bhoxh8/if_youre_looking_to_try_a_kaggle_competition_i/,1.0,0.0,0.0,2157.0,
110,2019-05-03 15:04:48,1556885088.0,kaggle,kaggle infrastructure,bk7ope,Responsible_Orange,,https://www.reddit.com/r/kaggle/comments/bk7ope/kaggle_infrastructure/,7.0,0.0,0.0,2182.0,"does anybody know details on what kind of infrastructure is required for kaggle to operate? how many GPUs, what is under the hood, what scale-ability and capacity looks like etc - are there any detailed papers available on what they needed when they started up and grew?"
111,2019-05-12 17:23:05,1557670985.0,kaggle,For absolutely beginners,bnph4n,dhrumilcse,,https://www.reddit.com/r/kaggle/comments/bnph4n/for_absolutely_beginners/,1.0,0.0,0.0,2213.0,
112,2019-05-12 18:05:24,1557673524.0,kaggle,"For absolute beginners, your first Kaggle competition submission",bnpwib,dhrumilcse,,https://www.reddit.com/r/kaggle/comments/bnpwib/for_absolute_beginners_your_first_kaggle/,9.0,0.0,0.0,2213.0,"For those of you looking to start with Kaggle competitions, here is a nice article explaining from data loading to data cleaning to predicting the output. Take a look at [Predict Who Survived the Titanic Disaster](https://towardsdatascience.com/your-first-kaggle-competition-submission-64da366e48cb)."
113,2019-05-13 16:12:55,1557753175.0,kaggle,Suicide Statistics using Python,bo3avs,aakashkh284,,https://www.reddit.com/r/kaggle/comments/bo3avs/suicide_statistics_using_python/,4.0,0.0,0.0,2216.0,
114,2019-05-15 04:40:23,1557884423.0,kaggle,Google’s AI Experts Try to Automate Themselves: AutoML finished 2nd,bormlq,fhoffa,,https://www.reddit.com/r/kaggle/comments/bormlq/googles_ai_experts_try_to_automate_themselves/,7.0,0.0,0.0,2222.0,
115,2019-05-17 16:29:10,1558099750.0,kaggle,Kaggle House Competition,bpr9z1,Simpatura,,https://www.reddit.com/r/kaggle/comments/bpr9z1/kaggle_house_competition/,1.0,1.0,0.0,2229.0,"For a university work, i have to try to predict the house prices of the kaggle house competetition. We have to use ibm spss but i really dont know what to do. Any tips?"
116,2019-05-22 03:53:09,1558486389.0,kaggle,"As a new Kaggler, Is it still worth while to learn and work with ML libraries like SciKit Learn or should one go straight to AutoML, H20?",bribgw,edmguru,,https://www.reddit.com/r/kaggle/comments/bribgw/as_a_new_kaggler_is_it_still_worth_while_to_learn/,4.0,5.0,0.0,2237.0,
117,2019-05-22 13:13:09,1558519989.0,kaggle,ML reproducibility and replacing Kaggle fetching scripts with DVC,brmwvv,thumbsdrivesmecrazy,,https://www.reddit.com/r/kaggle/comments/brmwvv/ml_reproducibility_and_replacing_kaggle_fetching/,1.0,0.0,0.0,2237.0,"The main ML reproducibility concerns are the following:

* Effectively versioning your models
* Capturing the exact steps in your data munging and feature * engineering pipelines
* Dependency management (including of your data and infrastructure)
* Configuration tracking

This project has a reasonably realistic setup for a production machine learning model deployment, complete with CI/CD pipeline integration and model versioning. The model in question is a Convolutional Neural Network for image classification, which uses data from the Kaggle v2 Plant Seedlings Dataset. The training data is 2GB and is not kept under version control: [First Impressions of Data Science Version Control (DVC)](https://medium.com/@christopher.samiullah/first-impressions-of-data-science-version-control-dvc-fe96ab29cdda)"
118,2019-05-25 23:32:02,1558816322.0,kaggle,How To Beat Kaggle (the Easy Way),bsz8g1,KappaClosed,,https://www.reddit.com/r/kaggle/comments/bsz8g1/how_to_beat_kaggle_the_easy_way/,1.0,0.0,0.0,2243.0,
119,2019-05-25 23:44:26,1558817066.0,kaggle,How To Beat Kaggle (the Easy Way),bszdgl,KappaClosed,,https://www.reddit.com/r/kaggle/comments/bszdgl/how_to_beat_kaggle_the_easy_way/,2.0,7.0,0.0,2243.0,
120,2019-05-26 05:31:33,1558837893.0,kaggle,"For those looking for partners to team up on a Kaggle competition, I made r/MachineLearningCollab",bt2tu7,BatmantoshReturns,,https://www.reddit.com/r/kaggle/comments/bt2tu7/for_those_looking_for_partners_to_team_up_on_a/,6.0,0.0,0.0,2243.0,"It's a subreddit to find people to work on machine learning projects with, 

r/MachineLearningCollab"
121,2019-05-28 12:54:52,1559037292.0,kaggle,Can I delete my account and again register with same email and mobile.,bty4nx,muke5hY,,https://www.reddit.com/r/kaggle/comments/bty4nx/can_i_delete_my_account_and_again_register_with/,1.0,1.0,0.0,2248.0,"I wanted to delete my account in Kaggle then again register with the same email with a different username.   

When we delete the account, do they also delete the username and its data?  

Can I use the same username again for a diffrent account?"
122,2019-05-30 02:27:46,1559172466.0,kaggle,Best IDE for Kaggle,bulvij,DanorRon,,https://www.reddit.com/r/kaggle/comments/bulvij/best_ide_for_kaggle/,3.0,10.0,0.0,2257.0,"(I also posted this in r/MachineLearning, but I think it belongs here more.)

I'm going to do a Kaggle competition, but since my main computer is a chromebook, I'm not sure what to use as an IDE (python). Any suggestions?"
123,2019-06-03 21:47:25,1559587645.0,kaggle,Searching for dark matter in the Large Hadron Collider dataset,bwebm3,0_marauders_0,,https://www.reddit.com/r/kaggle/comments/bwebm3/searching_for_dark_matter_in_the_large_hadron/,5.0,0.0,0.0,2272.0,
124,2019-06-09 20:47:47,1560102467.0,kaggle,How I made top 0.3% on Kaggle,bymvnt,0_marauders_0,,https://www.reddit.com/r/kaggle/comments/bymvnt/how_i_made_top_03_on_kaggle/,5.0,0.0,0.0,2298.0,
125,2019-06-10 21:01:32,1560189692.0,kaggle,Is there any Kaggle support which responses to the queries?,bz12bp,muke5hY,,https://www.reddit.com/r/kaggle/comments/bz12bp/is_there_any_kaggle_support_which_responses_to/,1.0,1.0,0.0,2308.0,"I had sent 3 support tickets but none of them got an answer yet, Just wondering is there any other way to contact them."
126,2019-06-17 10:21:43,1560756103.0,kaggle,Unable to login to kaggle. Loading takes forever.,c1kma7,Pradeeshbm67,,https://www.reddit.com/r/kaggle/comments/c1kma7/unable_to_login_to_kaggle_loading_takes_forever/,1.0,0.0,0.0,2330.0,
127,2019-06-19 13:10:28,1560939028.0,kaggle,Interviewing for Google AI Residency: My ML Journey,c2f8d2,init__27,,https://www.reddit.com/r/kaggle/comments/c2f8d2/interviewing_for_google_ai_residency_my_ml_journey/,2.0,0.0,0.0,2335.0,"Hi Everyone! 

The title really says it, I recently made it to the final rounds of the Google AI Residency interviews. This post describes my journey and experience:

&amp;#x200B;

Link to post: [https://medium.com/@init\_27/interviewing-for-google-ai-residency-a-kaggle-gold-finish-dsnet-launch-c621930b043d](https://medium.com/@init_27/interviewing-for-google-ai-residency-a-kaggle-gold-finish-dsnet-launch-c621930b043d)"
128,2019-06-21 22:19:09,1561144749.0,kaggle,"[Revision/Study Group] fast.ai Part 1 2019, Saturdays 4PM IST (Zoom calls)",c3f2u1,init__27,,https://www.reddit.com/r/kaggle/comments/c3f2u1/revisionstudy_group_fastai_part_1_2019_saturdays/,1.0,0.0,0.0,2348.0,
129,2019-06-23 16:51:41,1561297901.0,kaggle,Kernel for brain MRI dataset - segmentation with U-Net implementation in PyTorch,c44zbj,ketsok,,https://www.reddit.com/r/kaggle/comments/c44zbj/kernel_for_brain_mri_dataset_segmentation_with/,3.0,0.0,0.0,2358.0,
130,2019-06-24 11:28:03,1561364883.0,kaggle,Quora Insincere Questions Classification : two notebook tutorials using PyTorch,c4k73e,ahmedbesbes,,https://www.reddit.com/r/kaggle/comments/c4k73e/quora_insincere_questions_classification_two/,3.0,0.0,0.0,2359.0,
131,2019-07-02 20:34:00,1562088840.0,kaggle,What is. Kernel?,c8c518,thessain,,https://www.reddit.com/r/kaggle/comments/c8c518/what_is_kernel/,3.0,5.0,0.0,2392.0,Can somebody say in 2 sentence what a Kernel is in Data science?
132,2019-07-03 11:17:16,1562141836.0,kaggle,[Free + Online] Workshop on Getting Started with Kaggle using fast.ai + a Beginner friendly Comp,c8lhll,init__27,,https://www.reddit.com/r/kaggle/comments/c8lhll/free_online_workshop_on_getting_started_with/,1.0,0.0,0.0,2394.0,
133,2019-07-09 05:19:06,1562638746.0,kaggle,Kaggle Kernels Guide for Beginners - Step by Step tutorial,caulsx,dulldata,,https://www.reddit.com/r/kaggle/comments/caulsx/kaggle_kernels_guide_for_beginners_step_by_step/,11.0,0.0,0.0,2424.0,
134,2019-07-09 09:35:47,1562654147.0,kaggle,Recruiting for University of Washington interview study on Kaggle participation,cax4p4,uwkagglestudy,,https://www.reddit.com/r/kaggle/comments/cax4p4/recruiting_for_university_of_washington_interview/,2.0,0.0,0.0,2425.0,"Hello, 

We are researchers from the University of Washington, looking for participants to be interviewed for a study about collaboration in Kaggle competitions. 

We are interested in speaking with people who have participated in at least one Kaggle competition, and/or have engaged in any collaborative activities during a competition. Those collaborative activities might include but are not limited to participating in competition-related discussions online, sharing code/results, and/or helping others who are not on your team. We are interested in how and why people collaborate with each other during such competitions. 

The interview study will last approximately 15-60 minutes, which you may stop at any time. The interview will take place via an online video or voice call with one of the researchers. Although there will be no financial compensation for participation, we will be grateful for your time and input. 

If you are interested in participating in our study, please fill in this screening survey and follow the instructions in the survey: [https://forms.gle/DxJcgDhbH2EJHD4X6](https://forms.gle/DxJcgDhbH2EJHD4X6)

For more information or to sign up for the study, please direct message me.

Thanks in advance!!!"
135,2019-07-12 13:00:45,1562925645.0,kaggle,Prediction Model,cc8w7o,dsr_19,,https://www.reddit.com/r/kaggle/comments/cc8w7o/prediction_model/,3.0,1.0,0.0,2442.0,Does anyone know a project related to time series analysis which output a prediction?
136,2019-07-17 02:57:09,1563321429.0,kaggle,SQL certificate requirements clarification,ce55sv,BatGuy500,,https://www.reddit.com/r/kaggle/comments/ce55sv/sql_certificate_requirements_clarification/,3.0,0.0,0.0,2464.0,"I'm signed up for the summer camp thing that Kaggle is doing now. I just want to be sure, do I only need to complete and commit the exercises by the last day of the camp in order to get the certificate? I just want to make sure there are no other extra steps."
137,2019-07-17 07:20:31,1563337231.0,kaggle,"AMA with Francois Chollet, the creator of Keras",ce7xtm,init__27,,https://www.reddit.com/r/kaggle/comments/ce7xtm/ama_with_francois_chollet_the_creator_of_keras/,1.0,0.0,0.0,2464.0,"KaggleNoobs Community will be hosting an AMA with **Francois Chollet**, the creator of **Keras**  on 28th July, 2019 during 9 am - 10:30 am PT 

&amp;#x200B;

To Join, use this slack invite: [https://kagglenoobs.herokuapp.com/ ](https://t.co/BVPAIBoVy7) 

OR 

Leave your questions here, I'll post them during the AMA and post the complete AMA here afterward.  Till then, Francois Chollet was kind enough to share many great pieces of advice in this interview: [https://t.co/SmkDODXlFY](https://t.co/SmkDODXlFY)"
138,2019-07-17 14:22:52,1563362572.0,kaggle,Automatic notification of new competitions?,cebivv,YourWelcomeOrMine,,https://www.reddit.com/r/kaggle/comments/cebivv/automatic_notification_of_new_competitions/,1.0,1.0,0.0,2468.0,"Is there a way to be notified of all new competitions? The answers on the forums are over 5 years old. 

I know you can go to My Account --&gt; check ""Subscribe to mailing list for competition updates"", but this only sends an update every few weeks."
139,2019-07-19 19:40:40,1563554440.0,kaggle,0.000 Categorization Accuracy in Competition,cf9u6a,Capn_Sparrow0404,,https://www.reddit.com/r/kaggle/comments/cf9u6a/0000_categorization_accuracy_in_competition/,2.0,3.0,0.0,2479.0,"Hello, people.

I have recently used the Titanic dataset from kaggle ( [https://www.kaggle.com/c/titanic/data](https://www.kaggle.com/c/titanic/data) ) and built a machine learning model for the competition - **Titanic: Machine Learning from Disaster.** With the given training dataset, I built the model and the Random Forest Classifier I used gave 83% accuracy on validation dataset (accuracy is the evaluation metric required by the competition). So, I generated predictions for the test data and submitted the output. But the competition scoreboard gave me 0.0000 score. From the other answers in Kaggle forums, I read that the [score gives the percentage of correct predictions](https://www.kaggle.com/c/anomaly-detection-challenges-2015-challenge-2/discussion/17376) for the test data. So, it means none of my predictions are correct.

&amp;#x200B;

My questions:

How could that happen, despite a decent accuracy on validation dataset? And I am seeing only 1.000 and 0.000 in the scoreboard. How is the categorization accuracy calculated? 

&amp;#x200B;

Thank you in advance."
140,2019-07-21 21:23:09,1563733389.0,kaggle,Interview with World's First Triple Kaggle Grandmaster: Abhishek Thakur,cg27jw,init__27,,https://www.reddit.com/r/kaggle/comments/cg27jw/interview_with_worlds_first_triple_kaggle/,11.0,0.0,0.0,2490.0,"It's really an honor for me to kick-off The Chai Time Data Science Show with an interview with the Only Triple Grandmaster on Kaggle: 

&amp;#x200B;

Here are the links to the interview. You can find it both in audio and video (of the interview) format:

[Podcast](https://anchor.fm/chaitimedatascience/episodes/Kaggle-Triple-Grandmaster--Abhishek-Thakur-Interview-e4mjoi)

&amp;#x200B;

[Video](https://www.youtube.com/watch?v=vMtORPcjDn8&amp;list=PLyMom0n-MBrrGL8w-nD9kc2q5dOwN7Hb1&amp;index=2)

&amp;#x200B;

I'll be releasing 1 episode every Thursday, Sunday. 

Hope you like it, If you have any ideas/comments/suggestions, I'd really love to hear them."
141,2019-07-25 20:17:04,1564075024.0,kaggle,Winning Gold Medal on a Kaggle Competition using just kernels: Interview with Ryan Chesler,chqmg6,init__27,,https://www.reddit.com/r/kaggle/comments/chqmg6/winning_gold_medal_on_a_kaggle_competition_using/,1.0,0.0,0.0,2505.0,"To everyone who asks the question if free cloud resources are good enough for Kaggle Competitions, in this Interview with Kaggle Master Ryan Chesler, about his Gold Winning Solution to the Jigsaw ""Unintended Bias in Toxicity Classification"" Kaggle Competition, Ryan mentions their team did almost all of the workflow on JUST Kaggle kernels!  

Video: [https://www.youtube.com/playlist?list=PLyMom0n-MBrrGL8w-nD9kc2q5dOwN7Hb1](https://www.youtube.com/playlist?list=PLyMom0n-MBrrGL8w-nD9kc2q5dOwN7Hb1)

&amp;#x200B;

Podcast: [https://anchor.fm/chaitimedatascience/episodes/Interview-with-Kaggle-Master--ML-Engineer-Ryan-Chesler--Chai-Time-Data-Science-e4ntbt/a-ajj3f5](https://anchor.fm/chaitimedatascience/episodes/Interview-with-Kaggle-Master--ML-Engineer-Ryan-Chesler--Chai-Time-Data-Science-e4ntbt/a-ajj3f5)"
142,2019-07-25 20:17:12,1564075032.0,kaggle,Winning Gold Medal on a Kaggle Competition using just kernels: Interview with Ryan Chesler,chqmia,init__27,,https://www.reddit.com/r/kaggle/comments/chqmia/winning_gold_medal_on_a_kaggle_competition_using/,8.0,0.0,0.0,2505.0,"To everyone who asks the question if free cloud resources are good enough for Kaggle Competitions, in this Interview with Kaggle Master Ryan Chesler, about his Gold Winning Solution to the Jigsaw ""Unintended Bias in Toxicity Classification"" Kaggle Competition, Ryan mentions their team did almost all of the workflow on JUST Kaggle kernels!  

Video: [https://www.youtube.com/playlist?list=PLyMom0n-MBrrGL8w-nD9kc2q5dOwN7Hb1](https://www.youtube.com/playlist?list=PLyMom0n-MBrrGL8w-nD9kc2q5dOwN7Hb1)

&amp;#x200B;

Podcast: [https://anchor.fm/chaitimedatascience/episodes/Interview-with-Kaggle-Master--ML-Engineer-Ryan-Chesler--Chai-Time-Data-Science-e4ntbt/a-ajj3f5](https://anchor.fm/chaitimedatascience/episodes/Interview-with-Kaggle-Master--ML-Engineer-Ryan-Chesler--Chai-Time-Data-Science-e4ntbt/a-ajj3f5)"
143,2019-07-28 20:37:43,1564335463.0,kaggle,"Getting Hired in ML, Building a Portfolio | Interview with the CEO of SharpestMinds (ycombinator W'18): Edouard Harris",ciyrcu,init__27,,https://www.reddit.com/r/kaggle/comments/ciyrcu/getting_hired_in_ml_building_a_portfolio/,4.0,2.0,0.0,2521.0,"A chat about SharpestMinds, their ycombinator experience, and especially a great discussion about building a Machine Learning Portfolio and all things about getting hired that I enjoyed a lot.

&amp;#x200B;

Audio: [https://anchor.fm/chaitimedatascience/episodes/Interview-with-CEO-of-SharpestMinds--Edouard-Harris--Chai-Time-Data-Science-e4nti6](https://anchor.fm/chaitimedatascience/episodes/Interview-with-CEO-of-SharpestMinds--Edouard-Harris--Chai-Time-Data-Science-e4nti6)

&amp;#x200B;

Video: [https://www.youtube.com/watch?v=2-ejeSFCJJc&amp;list=PLyMom0n-MBrrGL8w-nD9kc2q5dOwN7Hb1&amp;index=4](https://www.youtube.com/watch?v=2-ejeSFCJJc&amp;list=PLyMom0n-MBrrGL8w-nD9kc2q5dOwN7Hb1&amp;index=4)"
144,2019-07-30 08:15:39,1564463739.0,kaggle,Open Image Kaggle challenge,cjn3op,shwetashri,,https://www.reddit.com/r/kaggle/comments/cjn3op/open_image_kaggle_challenge/,3.0,1.0,0.0,2527.0,"I did a few courses on TensorFlow in coursera and decided to enroll for kaggle challenge [https://www.kaggle.com/c/open-images-2019-object-detection/overview](https://www.kaggle.com/c/open-images-2019-object-detection/overview). I know I am being too optimistic but want to implement and explore, I am not interested in the scores but just want to start this off . With the amount of data, it has I may not be able to do it in  my machine but can certainly try to bring it to a logical end.  I will really appreciate if there is someone who is doing this and we can discuss this over. Thanks in advance."
145,2019-07-31 03:28:11,1564532891.0,kaggle,"Looking for a Kaggle dataset to do some regression or classification on for a semester research project. No requirements on the topic, only that it is clean data. Current potential topics are predicting video game sales, stock market prices based on google analytics trends, and credit card fraud.",ck0phz,tedhenson3,,https://www.reddit.com/r/kaggle/comments/ck0phz/looking_for_a_kaggle_dataset_to_do_some/,1.0,2.0,0.0,2533.0,
146,2019-08-01 14:41:15,1564659675.0,kaggle,Why my competition result disappeared from my profile page (like Titanic)?,ckn8s1,BeggarInSpain,,https://www.reddit.com/r/kaggle/comments/ckn8s1/why_my_competition_result_disappeared_from_my/,2.0,2.0,0.0,2542.0,"Hello, I've participated in 3 competitions on Kaggle but only 1 of them I can see now on my profile page in Competition Contributor section. Today, my Titanic competition result disappeared from it, though I can see my submission on the dataset page. Does anybody know wtf can going on with that? I have Kaggle profile linked to my resume and would really appreciate the results back. Thanks."
147,2019-08-01 21:57:27,1564685847.0,kaggle,Kaggle 1st Pos Solution of Data Science for Good: City of LA Kaggle Comp | Interview with Shivam Bansal,cksn57,init__27,,https://www.reddit.com/r/kaggle/comments/cksn57/kaggle_1st_pos_solution_of_data_science_for_good/,10.0,0.0,0.0,2542.0,"Interview with Shivam Bansal about his 1st position Winning solution to the Data Science for Good: City of LA Kaggle Comp

&amp;#x200B;

Podcast: [https://anchor.fm/chaitimedatascience/episodes/Data-Science-for-Good-City-of-LA-Kaggle-Winning-Solution-Interview-with-Kaggle-Kernels-Grandmaster-Shivam-Bansal-e4qc36/a-ak0h7g](https://anchor.fm/chaitimedatascience/episodes/Data-Science-for-Good-City-of-LA-Kaggle-Winning-Solution-Interview-with-Kaggle-Kernels-Grandmaster-Shivam-Bansal-e4qc36/a-ak0h7g)

&amp;#x200B;

Video: [https://www.youtube.com/watch?v=VdnUmrRuuWE&amp;list=PLyMom0n-MBrrGL8w-nD9kc2q5dOwN7Hb1&amp;index=5](https://www.youtube.com/watch?v=VdnUmrRuuWE&amp;list=PLyMom0n-MBrrGL8w-nD9kc2q5dOwN7Hb1&amp;index=5)"
148,2019-08-04 20:20:01,1564939201.0,kaggle,"Deep Learning Research, Deep Learning Hardware, Sparse Networks | Interview with Tim Dettmers",clyvgo,init__27,,https://www.reddit.com/r/kaggle/comments/clyvgo/deep_learning_research_deep_learning_hardware/,3.0,0.0,0.0,2552.0,"Interview with Tim Dettmers, PhD Student at University of Washington. 

We talk a lot about DL Research, DL Hardware :smile: and Tim's Kaggle experience 

Audio: https://anchor.fm/chaitimedatascience/episodes/Deep-Learning-Research--Hardware--Kaggle--Interview-with-Tim-Dettmers-e4qcad/a-ak0hr6

Video: https://www.youtube.com/watch?v=4857Lph2ndk&amp;feature=youtu.be"
149,2019-08-06 06:22:53,1565061773.0,kaggle,Kaggle FPGA training,cmlahn,Kainkelly2887,,https://www.reddit.com/r/kaggle/comments/cmlahn/kaggle_fpga_training/,2.0,0.0,0.0,2561.0,"Does anyone compete with models trained on FPGA's vs GPU's? My only concern would be that programming and reprogramming would take too long, or at when compared to a GPU."
150,2019-08-08 09:28:43,1565245723.0,kaggle,Invitation to KaggleExchange,cnhrjo,DesignerBe18,,https://www.reddit.com/r/kaggle/comments/cnhrjo/invitation_to_kaggleexchange/,1.0,0.0,0.0,2569.0,I have created a community where one can share their kaggle work with like minded people and recieve feedback and appreciation for it. Do join. Here is the community link:  [https://www.reddit.com/r/KaggleExchange/](https://www.reddit.com/r/KaggleExchange/)
151,2019-08-08 14:14:03,1565262843.0,kaggle,Looking for a Kaggle + Leetcode partner,cnk9kl,awesumsingh,,https://www.reddit.com/r/kaggle/comments/cnk9kl/looking_for_a_kaggle_leetcode_partner/,5.0,6.0,0.0,2570.0,"I'm at an intermediate level on LeetCode and between Beginner-Intermediate on Kaggle.
PM"
152,2019-08-09 04:51:46,1565315506.0,kaggle,Getting Started to Achieving Kaggle Kernels GM Rank #4 in just 9 months | Interview with Shivam Bansal,cnvkfb,init__27,,https://www.reddit.com/r/kaggle/comments/cnvkfb/getting_started_to_achieving_kaggle_kernels_gm/,1.0,0.0,0.0,2572.0,"Interview with Shivam Bansal, Kernels GM Ranked 4: 

Did you know Shivam made it to the Top 4 Rankings in Kernels after just 9 months of getting started on Kaggle!

We talk about his journey into Data Science, Kaggle. Shivam also shares his pipeline and motivation behind writing kernels. 

(Audio) https://anchor.fm/chaitimedatascience/episodes/Interview-with-Kaggle-Kernels-GM-Shivam-Bansal-e4qcbe/a-ak0id3

(Video) https://www.youtube.com/watch?v=0K4C1FMVbgQ"
